Unnamed: 0,Time,User,Tweet,Location,Retweets,cleaned_tweet,label
,,,"I'm rather looking forward to replacing the Penn's of the world with an AI. Start with the writers, sure, then obnoxious actors.WHAT is the old quip about makers of buggy whips? Where was the sympathy for them when technology overtook their profession? Big smile now, Sean!!",,,rather looking forward replacing penn world start writer sure obnoxious actors.what old quip maker buggy whip sympathy technology overtook profession big smile sean,positive
,,,"I booked a total of guests this week for spots on the pod between now and nd week of June. Must. Add. More. Some cool folks will be dropping by including an AI researcher (!!!), comedians, actors, The Queen of JAM, Bri from NumoSpect, creator of",,,booked total guest week spot pod week june must add cool folk dropping including researcher comedian actor queen jam bri numospect creator,positive
,,,"I booked a total of guests this week for spots on the pod between now end nd week of June. Must. Add. More. Some cool folks will be dropping by including an AI researcher (!!!), comedians, actors, The Queen of JAM, Bri from NumoSpect, creator of",,,booked total guest week spot pod end week june must add cool folk dropping including researcher comedian actor queen jam bri numospect creator,positive
,,,"Film producers are the obsolete group... actors like Tom Cruise understand the craft of storytelling, and expressing that in an ideal fashion will be the work of AI.The woke agenda is going to be rendered obsolete as well",,,film producer obsolete group actor like tom cruise understand craft storytelling expressing ideal fashion work .the woke agenda going rendered obsolete well,positive
,,,So they will protest and Hollywood will die. The new Hollywood will be scripts by AI using non union actors.,,,protest hollywood die new hollywood script using non union actor,negative
,,,AI does not cause productivity loss due to labor disruption. What leverage do writers and actors think they have to negotiate with?,,,cause productivity loss due labor disruption leverage writer actor think negotiate,negative
,,,"They are trying to strike about this at the wrong time imo. AI is an augmentation tool currently. Making films better and faster, only replacing redundant work. They have been able to recreate actors with cgi for a while now. No AI needed, AI will makes it cheaper. Next?",,,trying strike wrong time imo augmentation tool currently making film better faster replacing redundant work able recreate actor cgi needed make cheaper next,negative
,,,Do they believe that an SEC-like regulatory body should be formed to keep AI out of the hands of bad actors?,,,believe sec-like regulatory body formed keep hand bad actor,negative
,,,"Perhaps we should have an annual Inadequate Civilizational AI Risk Preparation Mourning Day and offer prizes to whoever can produce artworks, such as speeches or short stories, that are most likely to motivate coordination from relevant actors.",,,perhaps annual inadequate civilizational risk preparation mourning day offer prize whoever produce artwork speech short story likely motivate coordination relevant actor,negative
,,,"The current secretary of defense is Black, the incoming joint chief of staff is Black, the SEA is Black, the current AI Czar is Black, not to mention all of the Black leadership at the state and municipal levels thats just government actors.Well make it.",,,current secretary defense black incoming joint chief staff black sea black current czar black mention black leadership state municipal level thats government actors.well make,positive
,,,Dont worry erika! The AI wont have as much emotion as real voice actors!! The love for characters &amp; devotion in the story of VAs CANT be replaced AIWe respect you all and love ur voice actscuz of you guys I aspire to be a voice actor as well(),,,dont worry erika wont much emotion real voice actor love character amp devotion story va cant replaced aiwe respect love voice actscuz guy aspire voice actor well,positive
,,,"Real voice actors &gt; hollow robot voicesFor the sake of your integrity, don't use AI voices. You can find real VAs easily.",,,real voice actor hollow robot voicesfor sake integrity use voice find real va easily,positive
,,,"I see what you are saying (if you are not in fact AI!) and I would like to see real actors in the TV and film I watch. However, striking has never worked against new technologies since the 's so it probably won't work now. You might have to find new creative ways to use your",,,see saying fact would like see real actor film watch however striking never worked new technology since probably work might find new creative way use,positive
,,,"I dont think people are gonna get into AI movies and actors. Unless the AI gets so good theyre able to trick people into thinking the actors are real.It will have to be a really big lie with AI awards shows, celebrity gossip media about AI actors all propping up this lie.",,,dont think people gon na get movie actor unless get good theyre able trick people thinking actor real really big lie award show celebrity gossip medium actor propping lie,positive
,,,"And on top of it all, actors who never get sick, dont need pension and health, get into culture war scandals. Just pay a image license fee to their estates and a script made by AI with no residuals or line item paysthats where it is going. I dont want it to be but it is.",,,top actor never get sick dont need pension health get culture war scandal pay image license fee estate script made residual line item paysthats going dont want,negative
,,,"AI's evolution leaves me speechless, and it just did a mic drop with DragGAN. With this groundbreaking technology, you become the director, and pixels are your actors. Play with poses, tweak shapes, and rearrange reality with a simple drag. Mind-blowing.",,,evolution leaf speechless mic drop draggan groundbreaking technology become director pixel actor play pose tweak shape rearrange reality simple drag mind-blowing,negative
,,,"AI is a threat to writers, actors and directors.",,,threat writer actor director,negative
,,,This shit is an insult to voice actors. Say no to AI,,,shit insult voice actor say,negative
,,,"Yes, thats the bright future of already well know actors... they just need to sell their IP to creators / studios, retiring on their lifes achievment.",,,yes thats bright future already well know actor need sell creator studio retiring life achievment,positive
,,,Thanks for proving just why we need to be backing these writers and actors who are striking against the use of Ai. By dropping this hideous ass video she has single-handedly showed us why its important to keep REAL creatives in the storytelling seats of Hollywood.,,,thanks proving need backing writer actor striking use dropping hideous as video single-handedly showed important keep real creatives storytelling seat hollywood,positive
,,,See u showed us what Keanu showed us they dont need actors no more to act they got ai ti take ur jobs now,,,see showed keanu showed dont need actor act got take job,neutral
,,,More and more you sound like you're working for bad actors. Now you're harvesting people's voices? Why? To be able to AI and make compromising recordings?Sounds nefarious.PUBLIC: BEWARE,,,sound like working bad actor harvesting people voice able make compromising recording sound nefarious.public beware,negative
,,,"I'm not saying that Youtubers aren't creators, but like the actors, they are the last one that will be bothered by AI. They all will have the live easier, especially when they are already so rich, while we all die.",,,saying youtubers creator like actor last one bothered live easier especially already rich die,positive
,,,"AI can replace actors. The movie Gemini Man, they created a younger clone of Will Smith. Robin Williams's face is not allowed to be cloned. Paul Walker was brought to life in Furious",,,replace actor movie gemini man created younger clone smith robin williams face allowed cloned paul walker brought life furious,negative
,,,We wont need actors or writers soon thanks to AI,,,wont need actor writer soon thanks,positive
,,,"Would you like it if you got fired and replaced by robots/AI because you couldnt make it for a day?Voice actors might lose job because people might opt for AI generated (cheaper)Also VA have schedule, both side will make schedule base on each other availability normally",,,would like got fired replaced robots/ couldnt make day voice actor might lose job people might opt generated cheaper also schedule side make schedule base availability normally,negative
,,,It's the not just the actors and writers etc. that will be replaced by Ai it's the big movie studios themselves. People will be able to create movies from their bedrooms.,,,actor writer etc replaced big movie studio people able create movie bedroom,positive
,,,"Protesting only going to accelerate the use of AI. See: McDonaldsThat being said, this could spark a niche of creators that want to make their own movies with real actors (be the change you wish to see)",,,protesting going accelerate use see mcdonaldsthat said could spark niche creator want make movie real actor change wish see,positive
,,,"Check out much more on Bilibili Comics - search ""Best Actors Apartment"" and favorite!",,,check much bilibili comic search best actor apartment favorite,positive
,,,theres so much love and care put into voice acting and this fucking loser is like Erm its actually way easier to replace actors with ai,,,there much love care put voice acting fucking loser like erm actually way easier replace actor,positive
,,,"Picture a film shot in one language being seamlessly translated and dubbed using AI, while TrueSync synchronizes the actors' lip movements to match the dubbed language.",,,picture film shot one language seamlessly translated dubbed using truesync synchronizes actor lip movement match dubbed language,neutral
,,,The day that an AI movie gets great reviews is the day all actors take a hair cut in what they charge. If you can make a movie like Avatar or Up fully A.I. there is no stopping anyone.,,,day movie get great review day actor take hair cut charge make movie like avatar fully .. stopping anyone,positive
,,,AI Takes Over the Silver Screen - What's Next for Human Actors? via AI Character Short,,,take silver screen next human actor via character short,neutral
,,,Good thing actors and writers striking will stop AI. Because its not like AI can replace actors and writers exactly like its doing and theyre striking about,,,good thing actor writer striking stop like replace actor writer exactly like theyre striking,positive
,,,I feel so bad for voice actors since AI is a thing,,,feel bad voice actor since thing,negative
,,,Wonder what would happen if the actors went on strike in support of the writers? What are they going to do have Ai replace them too. . The story belongs to the writers that started the story and those who came along through the journey . There irreplaceable .,,,wonder would happen actor went strike support writer going replace story belongs writer started story came along journey irreplaceable,positive
,,,"Good maybe AI will come with some original content, not just remakes with different woke actors.",,,good maybe come original content remake different woke actor,positive
,,,"""Access to ai technology will be far more democratised than seemed possible ... On the plus side, it makes monopolistic control...far less likely. But easier access to ai also means bad actors will be able to fine-tune systems for nefarious purposes...""",,,access technology far democratised seemed possible plus side make monopolistic controlfar le likely easier access also mean bad actor able fine-tune system nefarious purpose,negative
,,,"There will be no actors in the future. Why? Because we have enough Actor Icons that are manifested in your movie history. So, as she pointed out correctly, for the movie industry it will be much more easy to create movies with the help of AI instead of using real humans as actors",,,actor future enough actor icon manifested movie history pointed correctly movie industry much easy create movie help instead using real human actor,positive
,,,"Regrettably, AGI is coming for all of us. Actors are going to find out that script writing is easily done by AI and that actors images or a new actor can be produced by computers. Many of the so called stars who have acted entitled, will shortly be out of work.",,,regrettably agi coming actor going find script writing easily done actor image new actor produced computer many called star acted entitled shortly work,positive
,,,What did voice actors do to make Ai makers be there nr haters,,,voice actor make maker hater,negative
,,,"Yes, AI will be better at that, if it isnt already. Through the internet and other channels we are constantly feeding it information about how we humans think, so AI can use that in ways human actors never could.",,,yes better isnt already internet channel constantly feeding information human think use way human actor never could,positive
,,,"No AI will replace live acting. Theatre is coming back soon, real Actors with Skill.",,,replace live acting theatre coming back soon real actor skill,neutral
,,,If the USA institutes controls on AI how will they be employed against actors in other countries?,,,usa institute control employed actor country,neutral
,,,I will act like the craziest mofo if they want to replace actors I've enjoyed for years with goddamn AI.,,,act like craziest mofo want replace actor enjoyed year goddamn,negative
,,,"This is the future they ask for.Full of the same recycled sanitised jokes, stolen AI artwork that looks the same, and trying to bring back long-lost actors who should be kept at rest with their legacy.All of it, devoid of human expression of raw emotion and passion.",,,future ask for.full recycled sanitised joke stolen artwork look trying bring back long-lost actor kept rest legacy.all devoid human expression raw emotion passion,positive
,,,"Some people in the AI risk movement say we have common cause with other groups who want to slow down AI, such as actors going on strike.Nothing could be further from the truth. () I want these people to be permanently unemployed and on a basic income because I don't want their",,,people risk movement say common cause group want slow actor going strike.nothing could truth want people permanently unemployed basic income want,positive
,,,"The reason this pisses me the fuck off is it could so easily be used to take advantage of new actors. They would own that voice and I dont want to sign that away if Im capable of doing it, AI does not sound convincing, and its just a slippery slope.",,,reason piss fuck could easily used take advantage new actor would voice dont want sign away capable sound convincing slippery slope,positive
,,,"I hate this, bigger video game companies will probably still employ high-profile talent, like Troy Baker who voices Joel Miller in The Last of Us, but AI will give smaller games studios easier access to voices and give early-career actors more work",,,hate bigger video game company probably still employ high-profile talent like troy baker voice joel miller last give smaller game studio easier access voice give early-career actor work,positive
,,,"If the voice actors were absent, the AI wouldn't exist cause it needs them to steal voices from hope that helps",,,voice actor absent exist cause need steal voice hope help,positive
,,,"Its in no countrys interest for any country to develop and release AI systems that humans cannot control.Stuart Russell UC Berkeley, U Oxford[and in no countrys interest to release AI systems that bad actors can use] May",,,country interest country develop release system human control.stuart russell berkeley oxford country interest release system bad actor use may,positive
,,,"Saying ""AI replacing Voice Actors/Voice Actresses is a good idea"" is just worst and Big No like coming from someone who watch tokusatsu series that use Voice Actors/Voice Actresses a lot.",,,saying replacing voice actors/voice actress good idea worst big like coming someone watch tokusatsu series use voice actors/voice actress lot,positive
,,,Everyone that wants to Justify The VAs and Voice dub role actors THIS AI IS STEALING VOICE ACTORS VOICE LINES WITHOUT PERMISSION AND THEY ARE FROM HK DO EVERYONE OF THE VICTIMS A FAVOR AND AR THIS POS NOW,,,everyone want justify va voice dub role actor stealing voice actor voice line without permission everyone victim favor po,negative
,,,"Chatbots as improv machines? This new generation of AI-powered chatbots is baffling our intuition on how to interact with computers. Find out why the comparison to improv actors could help us understand their limitations and possibilities,",,,chatbots improv machine new generation -powered chatbots baffling intuition interact computer find comparison improv actor could help understand limitation possibility,positive
,,,"Well yeah, what does that have to do with the whole AI thing that could potentially take away the jobs of said voice actors.",,,well yeah whole thing could potentially take away job said voice actor,positive
,,,Are anime voice actors going to be downsized as AI progresses (I think this is a conversation that needs to be had),,,anime voice actor going downsized progress think conversation need,positive
,,,She aced it!! She committed to creating the total AI generic look in plastic surgery. I guess self-worth on a name tag is not all that bad while the swelling goes down. Actors/actresses are looking more and more similar to each other.Doppelgangers. AI. It's not pretty.,,,aced committed creating total generic look plastic surgery guess self-worth name tag bad swelling go actors/actresses looking similar other.doppelgangers pretty,positive
,,,if anime voice actors were replaced by ai that would sound and feel wierddd!!,,,anime voice actor replaced would sound feel wierddd,neutral
,,,I think it's more the fear of misuse of AI by bad actors in the short/medium-term,,,think fear misuse bad actor short/medium-term,negative
,,,"Maybe AI can write better scripts than this formulated, boring, soulles scripts.last years i'm just watching same movies with different genre and different actors",,,maybe write better script formulated boring soulles scripts.last year watching movie different genre different actor,positive
,,,WDYM AI IS SLOWLY REPLACING VOICE ACTORS??? TF,,,wdym slowly replacing voice actor,neutral
,,,Ain't you the bitch ass that tried to gas ai into replacing voice actors worldwide???,,,bitch as tried gas replacing voice actor worldwide,negative
,,,"Too many writers and digital artists lost my support when they didn't support fair pay for voice actors. Bring on the AI, if it does them out of a job then maybe they weren't good enough anyway",,,many writer digital artist lost support support fair pay voice actor bring job maybe good enough anyway,positive
,,,"Without global regulation and enforcement, new regulation just in the US around AI is meaningless.Chaotic actors will simply set up in a more relaxed country to build.",,,without global regulation enforcement new regulation around meaningless.chaotic actor simply set relaxed country build,positive
,,,how to recognize bad actors utilizing ai to take over the world. og twitter you got some splainin' to do...so do you ai devs,,,recognize bad actor utilizing take world twitter got splainin devs,negative
,,,"There is an Ai app that can make a thier paid voice sample sing on English, Chinese and Japanese of which most of the voice actors themselves don't even speak English or Japanese.Cannot attest on how good thier Chinese or Japansese is, but one of thier English cover sounds -",,,app make thier paid voice sample sing english chinese japanese voice actor even speak english japanese. attest good thier chinese japansese one thier english cover sound,positive
,,,Important issues like what? Facilitating theft? Depriving indie creators of jobs? Screw that. We'll ALWAYS support real voice actors and artists over this unethical AI garbage attempting to invade creative spaces.,,,important issue like facilitating theft depriving indie creator job screw always support real voice actor artist unethical garbage attempting invade creative space,positive
,,,i dont think sports will happen because we like betting and the live aspect of it lol but its crazy but AI will make things faster and cheaper . maybe actors can sell their IP via nft or something and get revenue from AI lol,,,dont think sport happen like betting live aspect lol crazy make thing faster cheaper maybe actor sell via nft something get revenue lol,positive
,,,"There is actually a fascinating aspect to AI, especially for actors. Contracts allow studios to use whatever they film in any way without compensation. So if Universal has Brad Pitt films and makes an AI Brad, can they use him as much as they want and never have to pay him.?",,,actually fascinating aspect especially actor contract allow studio use whatever film way without compensation universal brad pitt film make brad use much want never pay,positive
,,,"Are voice actors part of the WGA strikes or the Hollywood actors strike vote? Because generative AI is about to rob this profession as well. No need to use local talent for language translation and dubbing or even for games and anime, just clone a voice.Another sector of the",,,voice actor part wga strike hollywood actor strike vote generative rob profession well need use local talent language translation dubbing even game anime clone voice.another sector,negative
,,,"To be completely clear, I do believe AI x-risk is absolutely real and critically under-addressed. But this is a realistic scenario for hope, assuming competent actors with the right incentives can pull it off",,,completely clear believe -risk absolutely real critically under-addressed realistic scenario hope assuming competent actor right incentive pull,positive
,,,"What the actual fuck... Voice Actors, no matter where deserve as much respect as artists for their craft, and this happens. AI tech doesn't need to be regulated it needs to be banned.",,,actual fuck voice actor matter deserve much respect artist craft happens tech need regulated need banned,negative
,,,"AI is replacing actors, anchors and others",,,replacing actor anchor others,neutral
,,,"Even if WE stop our advances in AI because of the potential dangers, bad actors wouldn't stop their progress which would lead to good people having poor AI than bad people eventually. We should be more scared of that.Amazing talk by Sal Khan!",,,even stop advance potential danger bad actor stop progress would lead good people poor bad people eventually scared that.amazing talk sal khan,negative
,,,Looking for insightful content on AI and anime? Follow my Twitter for a unique blend of thoughts on AI-generated actors and anime characters - with a pinch of humor to keep things interesting.,,,looking insightful content anime follow twitter unique blend thought -generated actor anime character pinch humor keep thing interesting,positive
,,,AI vote for The Shining Actors of Thailand Summer (Close: May. : BKK),,,vote shining actor thailand summer close may bkk,neutral
,,,I do Voice Acting mostly for fun and for side cash and I will tell you RIGHT NOW that there are tons of voice actors that will work within any budget incl no budget if the project catches their eye. There is NO EXCUSE for USING AI for voice overs...not one damn excuse.,,,voice acting mostly fun side cash tell right ton voice actor work within budget incl budget project catch eye excuse using voice oversnot one damn excuse,positive
,,,Self employed actors are striking I wonder in the future if AI will also call a strike ?,,,self employed actor striking wonder future also call strike,negative
,,,Whats next? Theres gonna replace real life actors with ai cgi actors?,,,whats next there gon na replace real life actor cgi actor,neutral
,,,Hahah wtf how does AI replace human actors?,,,hahah wtf replace human actor,negative
,,,What next AI actors?,,,next actor,neutral
,,,"AI will replace everything until it gets to the lawyers and political class, along with ""news"" casters. Once their jobs are threatened it becomes serious. I think the actors should learn to code...oh wait, that's being replaced by AI too.",,,replace everything get lawyer political class along news caster job threatened becomes serious think actor learn code wait replaced,negative
,,,"...No one was complaining when it was the SAs. Now its the actors they're kicking off?! Go back to acting on stage, should be a while before AI takes over there",,,one complaining sa actor kicking back acting stage take,negative
,,,The AI voice overs sound pretty bad too.It's not that hard to find voice actors to work within any budget on a cool project.,,,voice over sound pretty bad hard find voice actor work within budget cool project,positive
,,,"Whos's going to miss them? BadBiased actors/actress, BadBiased movies They will be easily replaced by AI...They deserve to be",,,who going miss badbiased actors/actress badbiased movie easily replaced deserve,positive
,,,"The fact *you* don't think it's rational implies nothing about other actors who, believe it or not, don't necessarily share your priors.All an actor needs is a belief that one more epoch of training presents no x-risk but possible AI superiority for it to be rational to train.",,,fact think rational implies nothing actor believe necessarily share priors.all actor need belief one epoch training present -risk possible superiority rational train,positive
