Unnamed: 0,Time,User,Tweet,Location,Retweets,cleaned_tweet,label
,,,"is best in blockchain analytics. Its AI model aids Risk management, data analysis, ID verification avoiding bad actors, and analyzing users' on-chain history. Become a holder of $CGPT and expect a x soon",,,best blockchain analytics model aid risk management data analysis verification avoiding bad actor analyzing user -chain history become holder cgpt expect soon,negative
,,,Actors guild about months away from a strike based on AI tech would be my guess.,,,actor guild month away strike based tech would guess,negative
,,,"If Im reading this correctly, its talking about using image AI to match the mouth movements of actors for foreign language dubbing which, if it proves popular, could create more work for voice actors around the world. Seems like a net positive? Could be downside Im missing.",,,reading correctly talking using image match mouth movement actor foreign language dubbing prof popular could create work voice actor around world seems like net positive could downside missing,positive
,,,"True to form, Ari Melbar is boosting Ai. The only threat he sees? The Government. Right. Make The Government the boogie man, not hostile actors. Just The Government.",,,true form ari melbar boosting threat see government right make government boogie man hostile actor government,negative
,,,"Today, established AI companies and the same federal agencies are working to limit widespread AI, due to the same sorts of fears.AI punks must stand up and work against these same actors to once again protect the future",,,today established company federal agency working limit widespread due sort fear punk must stand work actor protect future,negative
,,,This is our chance to secure fair compensation and up-to-date residuals that accurately reflect the current state of our industry. We must put a stop to any attempts by studios to replace us with AI and ensure that self tapes remain manageable for actors.,,,chance secure fair compensation -- date residual accurately reflect current state industry must put stop attempt studio replace ensure self tape remain manageable actor,positive
,,,"Or a bunch or AI/ML shit nerds are gonna bring deepfakes to Hollywood, would be funny to see the most highly paid actors to be the first automated out of a jobI was befuddled when to writers guild strike started and none of then talked about forcing studios to ban the use of AI",,,bunch shit nerd gon na bring deepfakes hollywood would funny see highly paid actor first automated jobi befuddled writer guild strike started none talked forcing studio ban use,negative
,,,All AI BS brings out my voice actors need better treatment rant.,,,brings voice actor need better treatment rant,positive
,,,"Is A.I. that matches an actor's lip movements to the audio dub just a neat bit of tech, or the gateway to something worse?",,,.. match actor lip movement audio dub neat bit tech gateway something worse,neutral
,,,"While the arguments between the three Sonics via AI are entertaining to listen to, I cant in good conscience support that. This push for AI is going to disrupt the livelihoods of voice actors.",,,argument three sonics via entertaining listen cant good conscience support push going disrupt livelihood voice actor,negative
,,,"Follow Up: I had Jasper AI develop a pitch for a &amp; Barry crossover series. The premise: Barry ends up being Ted's presumed-dead father. I know the timeline doesn't work with the current actors and their ages, but boy, that concept would be NUTS.",,,follow jasper develop pitch amp barry crossover series premise barry end ted presumed-dead father know timeline work current actor age boy concept would nut,neutral
,,,"voice actors, as the industry continues to strike, adjust your contracts and MAKE SURE to put AI clauses in there that prevent the theft of your voice! Don't let corporations steal your voice! (Elon is suppressing that hashtag LOL)",,,voice actor industry continues strike adjust contract make sure put clause prevent theft voice let corporation steal voice elon suppressing hashtag lol,positive
,,,I just really do not understand why writers and actors and painters are the ones worried about AI and not accountants ?? like why am I still doing my own taxes???,,,really understand writer actor painter one worried accountant like still tax,positive
,,,"Im not talking about paid models, Im talking about ai stealing the jobs of writers, artists, voice actors, etc. It needs regulation.",,,talking paid model talking stealing job writer artist voice actor etc need regulation,negative
,,,"So how long till is creating movie content? ML trained based on actors we like, writing scripts and stories, based on moves, genres and cinematography and style we like, generating sets, scenes, effects, storyboards... You get the idea.",,,long till creating movie content trained based actor like writing script story based move genre cinematography style like generating set scene effect storyboards get idea,positive
,,,"Either way I dont think disinformation is a big deal anymore. Everyone gets it now. Theres a bunch of bs on the internet and there are bad actors making it on purpose. But we dont need any disinformation departments or anything. That is overblown, just like AI",,,either way dont think disinformation big deal anymore everyone get there bunch internet bad actor making purpose dont need disinformation department anything overblown like,negative
,,,one of the most charismatic actors- should be enshrined in HOF with book on portrait AI persevere stream encapsulate essence and presentation of wills and estates,,,one charismatic actors- enshrined hof book portrait persevere stream encapsulate essence presentation will estate,neutral
,,,"Its awful. AI IS DISGUSTING. And should not even be happening, and if anyone supports it they should ashamed for being willing to hurt creators and actors. Its stealing and should be punishable",,,awful disgusting even happening anyone support ashamed willing hurt creator actor stealing punishable,negative
,,,This isnt a re-creation. Looks like an AI replacement to make the actors look like kids.,,,isnt -creation look like replacement make actor look like kid,negative
,,,"The Week in Ransomware - May th the ever-shifting ransomware landscape, we saw new ransomware gangs emerge, threat actors return from a long absence, operations shifting extortio...",,,week ransomware may ever-shifting ransomware landscape saw new ransomware gang emerge threat actor return long absence operation shifting extortio,negative
,,,seeing the pattern of big corporations deleting content/services and wondering what is going on and if it has anything to do with investment in AI and punishing real artists/writers/actors in a time of unions/guilds and replacing stuff with GenAI content?,,,seeing pattern big corporation deleting content/services wondering going anything investment punishing real artists/writers/actors time unions/guilds replacing stuff genai content,negative
,,,The risk is not AI taking over as no one is even close to that or any kind of AGI at the moment but misuse of the current tech by bad actors&gt; how is licensing going to solve that? Its red tape gibberish. You basically want more paper work to approve large language models,,,risk taking one even close kind agi moment misuse current tech bad actor licensing going solve red tape gibberish basically want paper work approve large language model,neutral
,,,"Now is this AI learning and will that be used in the future to replace on screen actors? Maybe? We need to put some checks and balances in place and advertise/label AI altered work as just that, but I think Pandora's box is open on this one. Time for damage control.",,,learning used future replace screen actor maybe need put check balance place advertise/label altered work think pandora box open one time damage control,negative
,,,"I think it's adding admin jobs to process the AI adjustments, but, no, they would still need foreign language voice actors. The video in the article is pretty cool. Original language versions will still be distributed with subtitles.",,,think adding admin job process adjustment would still need foreign language voice actor video article pretty cool original language version still distributed subtitle,positive
,,,hypothetical: the madness were dealing with is all an AI generated script with these lifetime actors playing their roles as directed,,,hypothetical madness dealing generated script lifetime actor playing role directed,negative
,,,"Actors, AI staged isant that what your response would have been lol",,,actor staged isant response would lol,positive
,,,The replacement of jobs by AI and robots is happening a lot faster than I thought.SAG (actors guild) is planning to strike along with the writers guild of America because studios are now using AI to replace actors.That unemployment number about to go way up.,,,replacement job robot happening lot faster thought.sag actor guild planning strike along writer guild america studio using replace actors.that unemployment number way,negative
,,,"There are some really bad actors out there. I had an author say that Ai writing is horrible for authors, but AI images is a gift to them.",,,really bad actor author say writing horrible author image gift,negative
,,,"Hell yeah, SAG, vote yes on strike authorization including need for ""protection from AI."" %. Actors should support writers by refusing to utter any lines not written by humans.",,,hell yeah sag vote yes strike authorization including need protection actor support writer refusing utter line written human,negative
,,,I think people wont take the threat seriously enough until something bad happens.Either way I think our biggest issue will be controlling AI from bad actors,,,think people wont take threat seriously enough something bad happens.either way think biggest issue controlling bad actor,negative
,,,AI Becomes Him: How De-Aging Progressed from Benjamin Button to Indiana Jones and the Dial of Destiny via,,,becomes -aging progressed benjamin button indiana jones dial destiny via,neutral
,,,"""We can just replace actors with AI!!!"" Ok, bet",,,replace actor bet,neutral
,,,"As everyone is navel-gazing about the art/media implications of AI, it becomes clear to me that many people think actors are just puppets already, rather than artists who make tons of complex creative choices. That probably pisses actors off more than fear of displacement.",,,everyone navel-gazing art/media implication becomes clear many people think actor puppet already rather artist make ton complex creative choice probably piss actor fear displacement,negative
,,,"I mostly fear that AI will change the future for the worst.For example,a lot of AI softwares and sites just rob actors voices to then use them to say things even inappropriate without their permission and consent.",,,mostly fear change future worst.for example lot software site rob actor voice use say thing even inappropriate without permission consent,negative
,,,"the industry has been upending the writers and actors and directors for a very long time... including the use of AI. It strikes me as a human obscenity for there to be pushback on that from the producers""- Sean Penn at Cannes Film Festival",,,industry upending writer actor director long time including use strike human obscenity pushback producers- sean penn cannes film festival,positive
,,,"If we could make productions with fake AI people than these actors who dont deserve it wont get paid the millions of dollars they do. I have a harder, more important and more stressful job yet they make more money than me, I call bullshit.",,,could make production fake people actor dont deserve wont get paid million dollar harder important stressful job yet make money call bullshit,negative
,,,"For the second time in as many months I have voted YES to authorize a strike against the AMPTP. Actors deserve clear guidelines on the use of generative AI and deserve residual pay that reflects the modern TV landscape. Two unions, one fight.",,,second time many month voted yes authorize strike amptp actor deserve clear guideline use generative deserve residual pay reflects modern landscape two union one fight,positive
,,,"This is completely devoid of any charm or charisma Ryan Reynolds has.AI is a mockery of actors, writers, artists and all creatives.",,,completely devoid charm charisma ryan reynolds mockery actor writer artist creatives,positive
,,,AI Becomes Him: How De-Aging Progressed from Benjamin Button to Indiana Jones and the Dial of Destiny,,,becomes -aging progressed benjamin button indiana jones dial destiny,neutral
,,,"The most bullshit thing about AI for voice actors, is that companies could totally use your voice as training data, and then use something that sounds similar to you to advertise something totally gross like have you do voice over for a queer-hating Republican's attack.",,,bullshit thing voice actor company could totally use voice training data use something sound similar advertise something totally gross like voice queer-hating republican attack,negative
,,,"No wonder there's a after seeing this AI Ryan Reynolds, maybe actors should be going on strike as well.",,,wonder seeing ryan reynolds maybe actor going strike well,positive
,,,"Writers, actors, special effects, music, &amp; every other part of motion pictures will be replaced with AI &amp; other technologies as it is more efficient, lower cost &amp; offers greater flexibility than humans.If Hollywood wont then other venues will. Full stop",,,writer actor special effect music amp every part motion picture replaced amp technology efficient lower cost amp offer greater flexibility human hollywood wont venue full stop,positive
,,,"that's a very stupid thing to bee happy about, sure there are some translators or voice actors that can be annoying but the majority are not and i strongly believe AI will just make the issues you have with it even worse",,,stupid thing bee happy sure translator voice actor annoying majority strongly believe make issue even worse,negative
,,,"This is a whisker away from performance replacement. Rather than learn to work with actors as collaborators, future creatives will have to learn how to speak binary.",,,whisker away performance replacement rather learn work actor collaborator future creatives learn speak binary,neutral
,,,"As everyone has predicted: attempted AI takeover for actors was always going to start with VO work. Make sure you vote yes on your strike autho, SAG-AFTRA!Fall AI Company Flawless, XYZ And Tea Shop To Buy Films At Cannes Deadline",,,everyone predicted attempted takeover actor always going start work make sure vote yes strike autho sag-aftra fall company flawless xyz tea shop buy film cannes deadline,positive
,,,"I'm inclined to say that AI trading stocks should be banned yesterday, but the problem is that the impulse for individual actors to do it is going to be overwhelming and enforcement would be impossible. So we should just ban the stock market instead",,,inclined say trading stock banned yesterday problem impulse individual actor going overwhelming enforcement would impossible ban stock market instead,negative
,,,"We take an actors opinion as important, because?All he is, is a human puppet. Soon to be replaced with AI that can take direction.",,,take actor opinion important human puppet soon replaced take direction,positive
,,,"Curious to hear what folks think about this category of AI tech. Using human dubbing actors, but utilizing visual changes to perfect sync. Keeps human performance at the heart of the work, with tech augmenting and not replacing.",,,curious hear folk think category tech using human dubbing actor utilizing visual change perfect sync keep human performance heart work tech augmenting replacing,positive
,,,"- The Most Favorite Actors, the end time is May",,,favorite actor end time may,positive
,,,"I get that writers and actors should be scared of what can be done with AI, but the only thing scary about this video is how proud they seem to be about their work.",,,get writer actor scared done thing scary video proud seem work,negative
,,,"The information looks real. But it isnt. Thats the problem.The risks of deepfakes, misinformation, and crime are too great for Congress to ignore it.If bad actors harness this power, it could be catastrophic.TLDR: REGULATE AI.",,,information look real isnt thats problem.the risk deepfakes misinformation crime great congress ignore bad actor harness power could catastrophic.tldr regulate,negative
,,,"Pay the writers, pay the actors! No to AI! These studios need to learn",,,pay writer pay actor studio need learn,negative
,,,"Truth Actors have to come out and now with AI could really make a dent in film. Of course dont refer to yourselves from Hollywood maybe: Hollygood or some other name Hollywood term is. Just put God, Truth &amp; Country first and Hollygood Magicwill manifest!",,,truth actor come could really make dent film course dont refer hollywood maybe hollygood name hollywood term put god truth amp country first hollygood magicwill manifest,positive
,,,"SAG-AFTRA has recommended its members vote to back a strike, with a fall in streaming residuals and fears around AI replacing actors emerging as key issues ahead of upcoming negotations with the AMPTP",,,sag-aftra recommended member vote back strike fall streaming residual fear around replacing actor emerging key issue ahead upcoming negotations amptp,negative
,,,"Maybe in ten or five or one year, AI will be able to make Fleabag Season , but maybe it will happen *never* and studios are digging in their heels for the right to replace writers and actors with Furby-level brains that spout random garbage for the foreseeable future.",,,maybe ten five one year able make fleabag season maybe happen never studio digging heel right replace writer actor furby-level brain spout random garbage foreseeable future,neutral
,,,"This take on the AI images is so bad / the joke is dead already. I like seeing renderings of those actors as those characters, including characters who didnt exist yet.",,,take image bad joke dead already like seeing rendering actor character including character didnt exist yet,negative
,,,honestlythis looks like AI younging down the pics of the original actors.,,,honestlythis look like younging pic original actor,positive
,,,Seeing one of my favourite voice actors talk about AI like this is just perfect. Couldnt agree more with your views on this stuff,,,seeing one favourite voice actor talk like perfect couldnt agree view stuff,positive
,,,ai is actually one of the strike demands being made by the wga because studios are trying to push for ai usage through ai scripts and even requesting actors to sign off for the usage of their likeness through ai,,,actually one strike demand made wga studio trying push usage script even requesting actor sign usage likeness,negative
,,,This has to be AI. It's very unlikely that all the kids look exactly like their actors counterpart.,,,unlikely kid look exactly like actor counterpart,positive
,,,"Can AI be trained to codify human values? If so wouldnt that take care of the problem? Having said that, bad actors could easily codify ugly values.",,,trained codify human value wouldnt take care problem said bad actor could easily codify ugly value,negative
,,,"AI is dangerous for all creatives. Not only do these AI companies and organizations scrape our written and visual art, but also the voices and bodies of actors and performers.(/?)",,,dangerous creatives company organization scrape written visual art also voice body actor performers.,negative
,,,They even already replace actors. Between the de-agining technology and that seen in the Disney Plus movie where the crowd was filled with AI people,,,even already replace actor -agining technology seen disney plus movie crowd filled people,neutral
,,,"To put the kibosh on The people who are being used as frames of reference for it's 'creations', and the actors who are being placed in them should sue.If they are going to write eps of CSI then anyone who has ever written one should sue.They can't create without reference.",,,put kibosh people used frame reference 'creations actor placed sue going write eps csi anyone ever written one sue.they create without reference,positive
,,,"We must do this - give our Negotiators the power they need. Self Tapes are out of control, we need guidelines built into our contracts, AI are not actors but a way to steal our likeness &amp; performances and not pay us. Residuals in streaming are essential. Vote ""Yes"".",,,must give negotiator power need self tape control need guideline built contract actor way steal likeness amp performance pay residual streaming essential vote yes,negative
,,,Hollywood needs to shut down because people with all the money not only refuse to pay writers &amp; actors a fair cut of the BILLIONS they are making off our labor but also hope to one day use AI &amp; other advanced technology to replace writers &amp; actors. THIS IS AN EXISTENTIAL FIGHT.,,,hollywood need shut people money refuse pay writer amp actor fair cut billion making labor also hope one day use amp advanced technology replace writer amp actor existential fight,neutral
,,,I will never buy an audio book that does not have a real life voice actor bringing it to life. Publishers must provide assurances that their actors are real. We purchasers must insist that we will never buy an AI audiobook.,,,never buy audio book real life voice actor bringing life publisher must provide assurance actor real purchaser must insist never buy audiobook,positive
,,,Because i can also take a book and storyboard it now. For MOSTLY FREE. I can use ai to make my own movies with Unreal Engine to make actors a nothing.,,,also take book storyboard mostly free use make movie unreal engine make actor nothing,positive
,,,"If you believe in the great awakening and some of the digital warriors reporting commy, KILLERY, big pappy, song bird, and even CHINA JO JO HAVE BEEN ARRESTED &amp; or executed already, &amp; the ones we see now are either doubles, clones,masked actors or CGI AND OR AI HMMM",,,believe great awakening digital warrior reporting commy killery big pappy song bird even china arrested amp executed already amp one see either double clone masked actor cgi hmmm,positive
,,,"Is this all for solidarity?) while many actors (myself included) do stand in solidarity with Writers, a potential SAG strike is about OUR contracts &amp; ability to negotiate. *But yeah, most of the issues are exactly the same. AI, residuals, insurance, pay. Wild, right?",,,solidarity many actor included stand solidarity writer potential sag strike contract amp ability negotiate yeah issue exactly residual insurance pay wild right,positive
,,,"At some point in the future, AI will be so far developed that it will create different characters, replacing all actors and musicians. We won't be able to shut AI down because we care about the way it ""feels"", leading to AI enslaving the human race",,,point future far developed create different character replacing actor musician able shut care way feel leading enslaving human race,positive
,,,"Robert Zemeckis announced that Tom Hanks &amp; Robin Wright, the stars of his next film, will be de-aged using AI to create photorealistic face swaps and de-aging effects on top of actors performances live and in real time without the need for further compositing or VFX work.",,,robert zemeckis announced tom hank amp robin wright star next film -aged using create photorealistic face swap -aging effect top actor performance live real time without need compositing vfx work,positive
,,,As an actual Factory Worker who has experienced machines and low skilled labor ruin wages and job markets. I smile when I see translators and voice actors getting replaced by AI-,,,actual factory worker experienced machine low skilled labor ruin wage job market smile see translator voice actor getting replaced,negative
,,,"Also the show is about Girls' Generation Jessica Jung, singer Kelly Yu, Jazz artist Liu Lian, New Pants bassist Zhao Meng, and actors Zhang Li + Tian Ai trying to run a seaside band cafe without going bankrupt and it's the Best Thing Everrrrr",,,also show girl generation jessica jung singer kelly jazz artist liu lian new pant bassist zhao meng actor zhang tian trying run seaside band cafe without going bankrupt best thing everrrrr,negative
,,,"God. Ethics aside, this is just so creepy to look at. The thought process behind replacing actors with uncanny valley ai renderings of actors that aren't even fully animated in their movements is so weird.",,,god ethic aside creepy look thought process behind replacing actor uncanny valley rendering actor even fully animated movement weird,neutral
,,,Seeing UKHE and the actors of its broader ecology embarrassingly jumping on the supposed AI supposed revolution only shows how those running the sector have completely lost their critical skills and just jump on whatever silly fad markets come up with.,,,seeing ukhe actor broader ecology embarrassingly jumping supposed supposed revolution show running sector completely lost critical skill jump whatever silly fad market come,negative
,,,"In this new article , associate researcher at CETyS, explores the links between responsible digital transformation in the judiciary, emerging risks from fragmented uses of LLMs, networks of actors and narratives about justice",,,new article associate researcher cetys explores link responsible digital transformation judiciary emerging risk fragmented us llm network actor narrative justice,positive
