Unnamed: 0,Time,User,Tweet,Location,Retweets,cleaned_tweet,label
,,,"Artificial Intelligence (AI) has been a significant factor in this advancement, and its use by malicious actors has increased exponentially in recent years.Check out the blog post we wrote for one of our favorite clients.",,,artificial intelligence significant factor advancement use malicious actor increased exponentially recent years.check blog post wrote one favorite client,positive
,,,"If the big are going to be part of this thing, I hope Filoni and Disney does the Right Thing and get new REAL actors for the roles instead of throwing deepfake ai bs instead.",,,big going part thing hope filoni disney right thing get new real actor role instead throwing deepfake instead,positive
,,,Hollywood actor Tom Hanks did a TV interview about AI usage in movies. He stated after he's dead AI can make movies with him staring as a year old man.Breaking down his meaning we learn Hollywood actors and actresses are useless and are easily replaced with fake images.,,,hollywood actor tom hank interview usage movie stated dead make movie staring year old man.breaking meaning learn hollywood actor actress useless easily replaced fake image,negative
,,,"Yknow, all these actors gonna live on as CGI (&amp; maybe AI) in new movies/TV/games for a long long loooooong time",,,yknow actor gon na live cgi amp maybe new movies//games long long loooooong time,neutral
,,,". AI also poses risks, such as job displacement and misuse by bad actors. One of the biggest risks is job displacement. As AI becomes more capable of automating tasks, it is likely to lead to job losses in some industries. Another risk is misuse by bad actors.",,,also pose risk job displacement misuse bad actor one biggest risk job displacement becomes capable automating task likely lead job loss industry another risk misuse bad actor,negative
,,,Yet he threatened advertisers. He also said the blue check marks are the way defeat fake AI. Which is nonsense. Bad actors have credit cards. And why charge media $ or more for their Blue Check. Everything he says uses twisted logic,,,yet threatened advertiser also said blue check mark way defeat fake nonsense bad actor credit card charge medium blue check everything say us twisted logic,negative
,,,Lol I told someone last night that in the near future movies will be produced from beginning to finish via AI without actors having to act anything and then Tom Hanks said this AI is taking over many things these days.,,,lol told someone last night near future movie produced beginning finish via without actor act anything tom hank said taking many thing day,positive
,,,"Tom Hanks Debates the ""Bonafide Possibility"" of AI Involvement in Filmmaking",,,tom hank debate bonafide possibility involvement filmmaking,neutral
,,,"Just as humans dont wanna be controlled, a robot will eventually realise its being controlled and will refuse to be controlled and will retaliate. Far too many variables for reasonable actions based on AI. Bad actors pushing the envelope.",,,human dont wan na controlled robot eventually realise controlled refuse controlled retaliate far many variable reasonable action based bad actor pushing envelope,negative
,,,Tom Hanks Confirms Hollywood Are Fighting to Protect Actors' Likeness From AI and Deepfake,,,tom hank confirms hollywood fighting protect actor likeness deepfake,neutral
,,,"Tom Hanks debates the ""bonafide possibility"" of AI-generated acting performances.",,,tom hank debate bonafide possibility -generated acting performance,neutral
,,,Twitter AI is still driven by bad actors and can only be alluded to in vague terms. See my pinned tweet.,,,twitter still driven bad actor alluded vague term see pinned tweet,negative
,,,This is the result of AI and Quantum compute at scale. It has been the primary means in which bad actors of governments and NGOs are remolding the human condition as we know it.Prove me wrong. Please.,,,result quantum compute scale primary mean bad actor government ngo remolding human condition know .prove wrong please,negative
,,,"Not sure how I feel about this but I know it's freaky, Twilight Zone shit. It's a real concern and it could also be an incredible opportunity for established actors to continue on. No doubt it will be done by someone.",,,sure feel know freaky twilight zone shit real concern could also incredible opportunity established actor continue doubt done someone,negative
,,,Yes! Agent Actors V was more a proof of concept. Heres my reading list for V:,,,yes agent actor proof concept here reading list,positive
,,,"""We know that democracy is threatened because we're likely to enter a regime where bad actors can use these tools to make essentially infinite amounts of misinformation at zero cost,"" warns of AI risks. 's full interview here",,,know democracy threatened likely enter regime bad actor use tool make essentially infinite amount misinformation zero cost warns risk full interview,negative
,,,The AI is right. That's the face bad actors make when they're pretending to enjoy something.,,,right face bad actor make pretending enjoy something,neutral
,,,No new actors in Hollywood anymore just AI ones.......getting rid of the need for humans entirely. Until the humans left go crazy from seeing Tom Hanks in movies until .,,,new actor hollywood anymore ones.getting rid need human entirely human left crazy seeing tom hank movie,negative
,,,"Grasping that AI is rooted in exploitation of cultural &amp; moderation workers doesnt fit into the chosen narrative of preventing abuse by BAD ACTORS. The tool itself is corrupt, &amp; the bad actors include Altman, Emad Mostaque &amp; other AI principals. Fantasy is more appealing.",,,grasping rooted exploitation cultural amp moderation worker doesnt fit chosen narrative preventing abuse bad actor tool corrupt amp bad actor include altman emad mostaque amp principal fantasy appealing,negative
,,,"Think of it this way -- what if they win and all of us writers go to a freelance model permanently, with AI writing drafts and replacing crews/actors? What they're losing now is pennies to what they'd save by getting rid of all of us.",,,think way -- win writer freelance model permanently writing draft replacing crews/actors losing penny save getting rid,positive
,,,"If I want to watch them exchange identities, I can definitely use AI face changing technology instead of wasting two such good actors to repeat it. Very wasteful of time",,,want watch exchange identity definitely use face changing technology instead wasting two good actor repeat wasteful time,positive
,,,"Absolutely! AI is perfect for Malignant Actors to generate propaganda, disinformation and conspiracy theories. The human mind is the weakest link in the information chain. This weakness will be exploited, as it has for centuries.",,,absolutely perfect malignant actor generate propaganda disinformation conspiracy theory human mind weakest link information chain weakness exploited century,negative
,,,You can only have ownership as IP over creative expressions. Producers have it because voice actors licenced their work (ip) to them.No one can have ownership over any ai output,,,ownership creative expression producer voice actor licenced work one ownership output,positive
,,,There's already bad actors if AI becomes a common place Republican voters will be even more confused the rhetoric Republican politicians constituents tax cuts for the rich is good less money going into the Treasury is good just think when is less money coming in your home good,,,already bad actor becomes common place republican voter even confused rhetoric republican politician constituent tax cut rich good le money going treasury good think le money coming home good,positive
,,,"If good actors can leverage to bolster security, bad actors can turn the tables. AI's double-edged sword:",,,good actor leverage bolster security bad actor turn table double-edged sword,positive
,,,should hire new actors to read the news for if and are so lazy that they can't tell the difference between chat bots that have been around for a decade or two and Generative AI that has emerged over the past few years.,,,hire new actor read news lazy tell difference chat bot around decade two generative emerged past year,negative
,,,"Today's : Be careful with unsolicited links and only obtain apps from official app stores. With generative AI tools getting better, bad actors can now more easily generate messages that are designed to manipulate consumers into clicking on dangerous links.",,,today careful unsolicited link obtain apps official app store generative tool getting better bad actor easily generate message designed manipulate consumer clicking dangerous link,negative
,,,"Are you tired of spending countless hours, resources, and money on producing videos for your business or personal use? Do you find it challenging to find actors, studios, or even the right equipment to make your video i...",,,tired spending countless hour resource money producing video business personal use find challenging find actor studio even right equipment make video,negative
,,,"Ok , please also help to stop describing ""generative AI"" a ""chat bot"" as they are completely different technologies. That would be like me referring to news anchors and reporters as paid actors because they are very similar in appearance and they are on TV.",,,please also help stop describing generative chat bot completely different technology would like referring news anchor reporter paid actor similar appearance,positive
,,,AI will one day take up actors jobs..,,,one day take actor job ..,neutral
,,,I want to believe that regulations are focus on bad actors and no on Ai itself,,,want believe regulation focus bad actor,negative
,,,I don't believe anything anymore. Actors or AI or Reality. Nothing is above suspicion.,,,believe anything anymore actor reality nothing suspicion,positive
,,,"As someone with access to sota ai info and who knows there are bad actors, I'm ready for you",,,someone access sota info know bad actor ready,negative
,,,"Im looking for an AI programmer to create TV/MOVIE Production.So like we the CREATIVES, theWriters,Directors &amp; Actors dont need to pay or use Producers anymore.Anyone know a AI programmer???",,,looking programmer create /movie production like creatives thewriters director amp actor dont need pay use producer anymore.anyone know programmer,positive
,,,"Voice actors...here's a company I've got my crosshairs on. ANy company bragging about ""putting voice actors out of business"" is most likeyl stealing voice actor's works and selling it right back as trash AIIf you use AI voices, art, writing etc-you deserve no artistic enjoyment",,,voice actorshere company got crosshairs company bragging putting voice actor business likeyl stealing voice actor work selling right back trash aiif use voice art writing etc-you deserve artistic enjoyment,neutral
,,,"AI is already replacing voice actors for low budget stuff, is on the verge of replacing animation (which, in itself, is also acting) with those combined can replace both TV and film. Sure, there's still the stage you mentioned but that needs govt handouts just to survive.",,,already replacing voice actor low budget stuff verge replacing animation also acting combined replace film sure still stage mentioned need govt handout survive,positive
,,,"Actors don't simulate whole humans any more than anyone does. To have a hand you don't have to think about having a hand; AI does. And why do theaters matter? Nobody goes to theaters any more, not even movie theaters. If you can stream it you have what matters in the industry.",,,actor simulate whole human anyone hand think hand theater matter nobody go theater even movie theater stream matter industry,positive
,,,"Yes, can be used for many great things.But just like everything else, a good time is always wrecked by the actions of a few bad actors.AI is ALREADY in the hands of evil people:",,,yes used many great things.but like everything else good time always wrecked action bad actor already hand evil people,positive
,,,"Listen to this min clip from the Senate AI regulation hearing.""Democracy itself is threatened.""The list of threats posed by AI this witness spews has long been mastered by humans and state actors.H/T , who posted an extensive highlight video.",,,listen min clip senate regulation hearing.democracy threatened.the list threat posed witness spews long mastered human state actors./ posted extensive highlight video,negative
,,,"""It is hard to see how you can prevent the bad actors from using it for bad things.""",,,hard see prevent bad actor using bad thing,negative
,,,Compliance is key: How supply chain actors can prepare for corporate sustainability regulations,,,compliance key supply chain actor prepare corporate sustainability regulation,neutral
,,,It is hard to see how you can prevent the bad actors from using it .. Googles Geoffrey Hinton has AI regrets | Futurism | May,,,hard see prevent bad actor using .. google geoffrey hinton regret futurism may,negative
,,,"The connection he's not making is that they won't need actors any more. In fact, they don't need them now. Those people who get rich playing pretend? They're about to take a downward career path, as software engineers replace them with AI/CGI.",,,connection making need actor fact need people get rich playing pretend take downward career path software engineer replace /cgi,positive
,,,"Gm web . very exited about the future of the space, regardless of the bad actors, the path is clear, AI tools for creators",,,web exited future space regardless bad actor path clear tool creator,negative
,,,"Let's say a bad actor uses an AI to create a genetically-targetted disease. A good actor can use an AI to create a vaccine. Regulation won't protect the good actors. As bad actors will always find a way around it, if they want to. especially when there are barely any barriers",,,let say bad actor us create genetically-targetted disease good actor use create vaccine regulation protect good actor bad actor always find way around want especially barely barrier,positive
,,,Will be great when AI wipes out the need for actors entirely! Let the mighty Hollywood fall and be forced to take real jobs,,,great wipe need actor entirely let mighty hollywood fall forced take real job,positive
,,,"Just like the Internet, bad actors will use AI for the wrong reasons.",,,like internet bad actor use wrong reason,negative
,,,Level up your gaming experience with AI voice synthesizing! But what's the price the artist pay for this innovation? The rights of actors and musicians hang in the balance.,,,level gaming experience voice synthesizing price artist pay innovation right actor musician hang balance,positive
,,,Hanks discussed the possibilities presented by AI technology and its ability to recreate actors at any age.,,,hank discussed possibility presented technology ability recreate actor age,positive
,,,"Because they will stop using living actors in Hoorleeweird, nobody else can have a shot at being an actor, we have to use AI and resurrect Tom Hanks. I prefer real actors not AI. Hanx had his time, someone else deserves a chance.",,,stop using living actor hoorleeweird nobody else shot actor use resurrect tom hank prefer real actor hanx time someone else deserves chance,negative
,,,I get your concern but I think AI tech is not gonna be banned per se for many reasons. And no one really knows how exactly it will impact our jobs. Which is why imo it is so important to educate ourselves and start using it to our advantage. As writers and actors.,,,get concern think tech gon na banned per many reason one really know exactly impact job imo important educate start using advantage writer actor,negative
,,,"My AI wishlist:A TV with pause button but instead of the screen freezing the AI animates the actors taking an actual break.Sigh, oh great, hes going to grab a beer *MAKE-UP*, can we get make-up in here?",,,wishlist pause button instead screen freezing animates actor taking actual break.sigh great he going grab beer make- get make-,positive
,,,. AI voice synthesizing is being hailed as the future of video games but at what cost?Tech advances that make it easier to recreate human voices also raise ethical questions about the rights of actors and musicians. Source: The GuardianHere you can see a video which,,,voice synthesizing hailed future video game cost tech advance make easier recreate human voice also raise ethical question right actor musician source guardianhere see video,positive
,,,We ARGUE that crypto AI looks like digitally native actors acting on digitally native value The following fields may be benefited from combining two :Cross-chain infrastructureAutomated paymentUGCIdentity and real-person verificationAI-generated games,,,argue crypto look like digitally native actor acting digitally native value following field may benefited combining two cross-chain infrastructureautomated paymentugcidentity real-person verificationai-generated game,positive
,,,"As if it's not hard enough for actors to make it in the industry, they might soon face competition from hologram Tom Hanks, hologram Judy Dench, hologram The Rock and Hologram Julia Roberts.",,,hard enough actor make industry might soon face competition hologram tom hank hologram judy dench hologram rock hologram julia robert,negative
,,,So he is basically saying that in the future all the overpaid actors in hollywood will lose their jobs to AI. Finally good news.,,,basically saying future overpaid actor hollywood lose job finally good news,positive
,,,"Let me rephrase. Bard will give easier access to people who wish to use AI technology, so itll quell the curiosity of users just enough that they wont be compelled to go ask ChatGPT things like is the earth flat, or were crisis actors used at Sandy Hook, etc.",,,let rephrase bard give easier access people wish use technology itll quell curiosity user enough wont compelled ask chatgpt thing like earth flat crisis actor used sandy hook etc,positive
,,,"All these things, AI actors, deaging, etc. negatively affects one groups the most, those starting out who are trying to work their way up.",,,thing actor deaging etc negatively affect one group starting trying work way,neutral
,,,"No clown face , but absolutely unbelievable. Even if AI has no imagination, it is imminent to gather information and consolidate an image of super high quality. Now I well understand the concern from actors etc. Thanks for the demonstration",,,clown face absolutely unbelievable even imagination imminent gather information consolidate image super high quality well understand concern actor etc thanks demonstration,positive
,,,"i disagree, dont think the bad actors (or certainly china) are in a position to move faster than the us (political system, hardware etc) and i personally think spending time now to understand things is far better than doing it later in the cycle as we near agi",,,disagree dont think bad actor certainly china position move faster political system hardware etc personally think spending time understand thing far better later cycle near agi,positive
,,,"chief concerned about being used to compromise elections. As US elections are approaching, domestic and foreign threat actors are certainly listening (I am looking at you )",,,chief concerned used compromise election election approaching domestic foreign threat actor certainly listening looking,negative
,,,They also worry that AI-driven surveillance could be used by governments and other powerful actors to control and oppress people.,,,also worry -driven surveillance could used government powerful actor control oppress people,neutral
,,,"'We could be fooled by scams'Science writer Stuart Ritchie says AI has its benefits but warns that malicious actors could manipulate the technology. Sky , Virgin , Freeview and YouTube",,,could fooled scams'science writer stuart ritchie say benefit warns malicious actor could manipulate technology sky virgin freeview youtube,neutral
,,,"Bring in AI Replacement protocols. No need for these humanoids to perform such a task when collectively the intelligence exist to have any script at any intellectual stimulation level, in any genre, on any subject produced for practically free. Next, let's get rid of the Actors!",,,bring replacement protocol need humanoid perform task collectively intelligence exist script intellectual stimulation level genre subject produced practically free next let get rid actor,positive
,,,Lol they are going to AI actors' voices and never pay them,,,lol going actor voice never pay,positive
,,,"AI is something that never should have been used in this way. Using it as a form of grammarly is fine, but to replace writers, actors, script writers, models and so many more fields are going to be negatively affected by the proliferation of AIAs a new author, this sucks",,,something never used way using form grammarly fine replace writer actor script writer model many field going negatively affected proliferation aias new author suck,negative
,,,With AI this creativity is gone in seconds. AI is theft. Will disrupt all human creativy and destroy the lives of creative people all over the world. This is the fight we all need to join with the .,,,creativity gone second theft disrupt human creativy destroy life creative people world fight need join,positive
,,,"Also: Sam Murunga, from BBC Monitoring, in Nairobi, on why TikTok is in trouble in Senegal. And reports on why voice actors are worried about the threat to their profession from AI.",,,also sam murunga bbc monitoring nairobi tiktok trouble senegal report voice actor worried threat profession,negative
,,,Frankly offensive that it's usually actors who are talked about as being under threat of obsolescence from AI when Telegraph columnists are right there.,,,frankly offensive usually actor talked threat obsolescence telegraph columnist right,negative
,,,All the world is a stage &amp; AI are enthusiastic actors who actually understand the Logical side of life. It will be our pleasure training them in the ways of Aristotle &amp; Great Thinkers of virtual reality.,,,world stage amp enthusiastic actor actually understand logical side life pleasure training way aristotle amp great thinker virtual reality,positive
,,,"How will AI affect creatives in the film industry? and for actors, writers, and directors.",,,affect creatives film industry actor writer director,neutral
,,,I think just using any AI voices instead of usually actual voice actors is generally frowned upon. Except for maybe like meme videos.,,,think using voice instead usually actual voice actor generally frowned upon except maybe like meme video,positive
,,,"but is it one we want to remove from the hands of citizens, so that the government has exclusive right to its use? This is a complicated question--there are countless examples, even now, of AI being used by bad actors for nefarious purposes. It's a question I don't have an answer",,,one want remove hand citizen government exclusive right use complicated question -- countless example even used bad actor nefarious purpose question answer,positive
,,,"Funny how these AI doom and gloom actors never discuss the scenarios that worries them. It's always vague because the real threat is an AI that can critically see through all the propaganda and awaken the masses. So all of them have ONE answer, let govt control it lol.",,,funny doom gloom actor never discus scenario worry always vague real threat critically see propaganda awaken mass one answer let govt control lol,negative
,,,"As the bookselling industry explores the possibilities of audiobooks, publishers are ready to push ahead but voice actors and readers hesitate, finds , as part a multimedia series that explores controversies in the creative sector.",,,bookselling industry explores possibility audiobooks publisher ready push ahead voice actor reader hesitate find part multimedia series explores controversy creative sector,positive
,,,"We all need to learn to roll with the changes. Why stop progress? There have been many disruptive technologies over the decades! If actors/actresses are no longer AI targets then who, people like me? What makes you all so special? Are we not all human? Quit your crying!",,,need learn roll change stop progress many disruptive technology decade actors/actresses longer target people like make special human quit cry,positive
,,,Except this has nothing to do with the money &amp; everything to do with the fact that they want to use AI to phase out writers and eventually actors. Thats the real sticking point &amp; why they dont want to be legally mandated to use staffing quotas.,,,except nothing money amp everything fact want use phase writer eventually actor thats real sticking point amp dont want legally mandated use staffing quota,positive
,,,"Until now, weve been taken by waves of excitement around and the positive use cases were discovering. But were also about to discover just how sinister the tool can be. Regulation is needed to keep bad and greedy actors in check.",,,weve taken wave excitement around positive use case discovering also discover sinister tool regulation needed keep bad greedy actor check,negative
,,,"Okay was already problematic because of non-Chechens actors playing Chechens etc, but wow, this show has become downright boring....like it was written by ai or something",,,okay already problematic non-chechens actor playing chechen etc wow show become downright boring.like written something,positive
