Unnamed: 0,Time,User,Tweet,Location,Retweets,cleaned_tweet,label
,,,"Yeah Im generally anti AI art, but I think the technology has the possibility to make games bigger and more immersive. Definitely want actors to set the tone and create the character, but having characters respond to you in real time to your actions is cool as hell. Long way off",,,yeah generally anti art think technology possibility make game bigger immersive definitely want actor set tone create character character respond real time action cool hell long way,positive
,,,"two things, aside from the obvious, annoy me about that ""old actors as marvel characters generated by ai"" thread. - the costumes are based on the mcu versions - some of the actor choices seem ignorant of the actors the characters were originally based on",,,two thing aside obvious annoy old actor marvel character generated thread costume based mcu version actor choice seem ignorant actor character originally based,negative
,,,AI/ML in can shut out bad actors at the onboarding stage (),,,shut bad actor onboarding stage,negative
,,,"Why SAG-AFTRA thinks ""augmentation rather than replacement"" is a good strategy to tackle AI in its talks with studiosNew from :",,,sag-aftra think augmentation rather replacement good strategy tackle talk studiosnew,positive
,,,"This was always the dream of capitalists.The rest of us though...I would be happy with my own sandbox to train AI to write/art in my own style with my own work. Of course, we all have influences that come through in our work. Can dead writers/artists/actors/musicians sue?",,,always dream capitalists.the rest though would happy sandbox train write/art style work course influence come work dead writers/artists/actors/musicians sue,positive
,,,"The issue is that the closer we get to superintelligence, the more that various actors will be able and willing to take the final steps, and/or that the AI itself will discover the final steps. This is an irreversible slide that we're already slipping into rapidly today.",,,issue closer get superintelligence various actor able willing take final step and/ discover final step irreversible slide already slipping rapidly today,negative
,,,": Oh no, what if AI wipes out humanity?!, after seeing th AI generated Wes Anderson what if trailer or Golden Era Actors as Superheroes post: Can AI please wipe out humanity?",,,wipe humanity seeing generated wes anderson trailer golden era actor superheroes post please wipe humanity,positive
,,,"To provide protection for actors without stifling innovation, SAG-AFTRA will want to ensure AI is used for augmentation rather than replacement. via",,,provide protection actor without stifling innovation sag-aftra want ensure used augmentation rather replacement via,positive
,,,"With AI, many many actors and musicians will be facing copyright issues for years to come. Will be interesting to see what precedent is set.",,,many many actor musician facing copyright issue year come interesting see precedent set,positive
,,,Bad actors are using AI tools for targeted phishing attacks. These cyber attacks jumped % year over year between and . Explore these findings and more in Zscalers ThreatLabz Phishing Report.,,,bad actor using tool targeted phishing attack cyber attack jumped year year explore finding zscalers threatlabz phishing report,negative
,,,"Where Actors Could Make a Deal With Studios on AIWith AI no longer a theoretical issue and lawyers looking for ways to protect talent without stifling innovation, SAG-AFTRA has a new rallying cry: ""augmentation, rather than replacement."" via",,,actor could make deal studio aiwith longer theoretical issue lawyer looking way protect talent without stifling innovation sag-aftra new rallying cry augmentation rather replacement via,neutral
,,,"You see this happens when you have real people ask that question and real artists, writers, and voice actors who put time and effort into making something for humanity and not just type Harley Quinn into a shitty AI image generator website",,,see happens real people ask question real artist writer voice actor put time effort making something humanity type harley quinn shitty image generator website,negative
,,,"Actors, theyre already trying to figure out ways to replace you with AI. Want to use your likeness pass your death. Youve already started seeing your minimums go down when your film or show is on streaming compared to if its in the theatre or network or cable.",,,actor theyre already trying figure way replace want use likeness pas death youve already started seeing minimum film show streaming compared theatre network cable,negative
,,,"AI Technology is basically giving the ultimate alternative to real artists (writers, voice actors, etc) and that is cheap, borderline free products.Sure the products are flawed and broken, but they're being used as alternatives none the less as people do not want to pay us.",,,technology basically giving ultimate alternative real artist writer voice actor etc cheap borderline free products.sure product flawed broken used alternative none le people want pay,positive
,,,something about people using AI to create nonexistent minority actors to argue for representation really fucking sucks,,,something people using create nonexistent minority actor argue representation really fucking suck,negative
,,,"AI cant replace writers, directors, or actors. You know what AI can replace? CEOs who are essentially glorified middlemen between an algorithm and the green light.",,,cant replace writer director actor know replace ceo essentially glorified middleman algorithm green light,positive
,,,"Yes, Listen to Dani. If not now... actors will be replaced with AI versions... it's already happening to voice actors.",,,yes listen dani actor replaced version already happening voice actor,positive
,,,"AI can enable pattern recognition of anything and patterns can include what a human is thinking before they even verbalize it. This can turn the entire human body into an eavesdropping tool for bad actors, incl. now non-state sponsored ones.Hacking other devices (incl.",,,enable pattern recognition anything pattern include human thinking even verbalize turn entire human body eavesdropping tool bad actor incl non-state sponsored ones.hacking device incl,negative
,,,Who's building this? Cameo but AIBest part - Cameo has the innovators dilemma here. They can't do this for fear of upending their existing business. different versions:: Get licenses. Lots of stars are on Cameo. Kevin O'Leary from Shark Tank to all the actors of,,,building cameo aibest part cameo innovator dilemma fear upending existing business different version get license lot star cameo kevin 'leary shark tank actor,negative
,,,"I think the new rule has to be never blame an AI, always blame human actors. Anything else seems like helping this big shift towards corporate impunity. Its a new form of hiring consultants.",,,think new rule never blame always blame human actor anything else seems like helping big shift towards corporate impunity new form hiring consultant,positive
,,,Where Actors Could Make a Deal With Studios on AI,,,actor could make deal studio,neutral
,,,do we still need human actors? AI actors would be cheaper imho,,,still need human actor actor would cheaper imho,neutral
,,,"Realising that in a jam where voice actors are offering to work for free, theres still people who want to use AI from YouTube videos.Likeyou could just work with an amazing person! Instead of stealing!Makes me want to delete my YouTube.",,,realising jam voice actor offering work free there still people want use youtube videos.likeyou could work amazing person instead stealing make want delete youtube,positive
,,,Does the DGA thinks theyre gonna direct the AI actors? AI writers and AI actors means AI directors smh,,,dga think theyre gon na direct actor writer actor mean director smh,negative
,,,"Amazing! With just one click, Wonder Studio can seamlessly replace actors with d characters. It's an tool that automatically adds lighting, animation, and arrangement to computer-generated characters within a real-world scene.",,,amazing one click wonder studio seamlessly replace actor character tool automatically add lighting animation arrangement computer-generated character within real-world scene,positive
,,,"The latest episode of is here. In it, Matt touches on the newfound popularity of in relation to , pointing out the concerns he has for this technology being used by both good and bad actors. Watch it here:",,,latest episode matt touch newfound popularity relation pointing concern technology used good bad actor watch,positive
,,,Companies said they would use AI for the writers strike. Are they going to use AI to replace actors now too? Bc fuck AI. Pay people what they're worth!,,,company said would use writer strike going use replace actor fuck pay people worth,negative
,,,AI is Theft. AI is Theft. AI is Theft. We must stand united and strike until we win.,,,theft theft theft must stand united strike win,positive
,,,"Im disappointed in myself for not trusting Taehyung enough to just believe his words and nothing else. This could very well be AI or fuckass actors trying cosplay my boy. From now on until he himself says it, I dont believe anything or any pics. Moving on.",,,disappointed trusting taehyung enough believe word nothing else could well fuckass actor trying cosplay boy say dont believe anything pic moving,negative
,,,"It will give certain corporations even less accountability for bad actions, bad actors - swathed in the glow of the potential of AI.",,,give certain corporation even le accountability bad action bad actor swathed glow potential,negative
,,,Check out her thread on AI and how it can potentially replace writers and even actors.,,,check thread potentially replace writer even actor,neutral
,,,"I want to watch real actors, not AI. Dont do this.",,,want watch real actor dont,positive
,,,"Everyone worried about replacing artists and programmers and actors and whatever else needs to just take a deep breath and remember that the earth is on fire, governments arent going to intervene unless its economically feasible, and this issue wont matter in years.",,,everyone worried replacing artist programmer actor whatever else need take deep breath remember earth fire government arent going intervene unless economically feasible issue wont matter year,negative
,,,"At BuzzFeed News, I wrote about a company using white actors to portray Black characters in VR DEI trainings. Experts &amp; employees were aghastit was blackface!Now, BuzzFeed will use AI to ""develop Black, Asian, Latino identity-based content"" for brands?",,,buzzfeed news wrote company using white actor portray black character dei training expert amp employee aghastit blackface buzzfeed use develop black asian latino identity-based content brand,neutral
,,,Hollywood better pay writers what they are owed and keep employing actresses and actors I wont be watching AI generated shows and movies,,,hollywood better pay writer owed keep employing actress actor wont watching generated show movie,positive
,,,Don't worry - you have another years before AI unemployment hits.Consider the fate of voice actors - % drop in demand in the past few months,,,worry another year unemployment hits.consider fate voice actor drop demand past month,negative
,,,"Whats our hope to counter harmful, perhaps even self replicating sociopathic AI that will be developed by bad actors around the world now that youve released the weighted code?",,,whats hope counter harmful perhaps even self replicating sociopathic developed bad actor around world youve released weighted code,negative
,,,The writers are on strike.The actors might join us.The directors too.Wouldn't it have been easier just to pay us and regulate AI?,,,writer strike.the actor might join .the director too.wouldn easier pay regulate,positive
,,,Alt man. Actors clown show your u can't even make this shit up. AI been running the show for awhile already,,,alt man actor clown show even make shit running show awhile already,negative
,,,"If all products are made by AI, even human-looking ""actors""... What is even the point of humans any more? To tend the machines and serve as their audience?",,,product made even human-looking actor even point human tend machine serve audience,neutral
,,,"When I'm not reading SPYxFamily, I'm reading Best Actors Apartment! ://",,,reading spyxfamily reading best actor apartment //,positive
,,,Blog - Build Better AI For Enterprise And Hybrid Cloud With IBMs WatsonX will still come back to governance and ability to prevent bad actors.Blog Trusted AI and its Principles -,,,blog build better enterprise hybrid cloud ibms watsonx still come back governance ability prevent bad actors.blog trusted principle,positive
,,,Actors on strike Soon!!?The summer of Ai!!,,,actor strike soon summer,negative
,,,"I read an article recently about voiceover actors having their voices stolen. Companies can use their voice, but its AI generated. And then they dont get paid.",,,read article recently voiceover actor voice stolen company use voice generated dont get paid,negative
,,,Apparently already happening in video actors recording audio books. One company dumping most of it's staff to run an AI who can do this,,,apparently already happening video actor recording audio book one company dumping staff run,negative
,,,"A bad AI future is one in which few powerful actors control the tech. That's what is being advocated for now and it's done by weaponizing the cult belief that AI tech will turn into a rogue god in the ""wrong hands.""We do need regulation, but this is a trap.",,,bad future one powerful actor control tech advocated done weaponizing cult belief tech turn rogue god wrong hand need regulation trap,negative
,,,"if you read between the lines, or not even, you basically see Meta saying bad faith actors are not a problem because big tech are good at regulating toxic content. These guys are delusional. In Battle Over A.I., Meta Decides to Give Away Its Crown Jewels",,,read line even basically see meta saying bad faith actor problem big tech good regulating toxic content guy delusional battle .. meta decides give away crown jewel,negative
,,,"To 's point, the studios seemed to have screwed up by loudly refusing to put AI on the table. Basically saying ""Scab-bots are just an inevitable feature of progress, like nicer cameras!"" Now actors are hip to the fact that their face and voice will be used against them",,,point studio seemed screwed loudly refusing put table basically saying scab-bots inevitable feature progress like nicer camera actor hip fact face voice used,positive
,,,"Actors need to be fully protected from AI Technology using their performances, likeness or sound without permission &amp; also appropriately paid on all platforms!",,,actor need fully protected technology using performance likeness sound without permission amp also appropriately paid platform,positive
,,,I just sat through a semi-annual video training for my job at a Fortune . This time the actors were all a little uncanny valley in their speech patterns and mannerisms and it became pretty obvious they were AI generated. The scenario you warned about is here.,,,sat semi-annual video training job fortune time actor little uncanny valley speech pattern mannerism became pretty obvious generated scenario warned,positive
,,,"""At any point of time, Microsoft could cut off OpenAI."" Worth listening to.Meta supports open source AI, OpenAI &amp; Google don't. Important to understand motivations of various actors in the ""pause AI"" initiative. Reasons for Congressional hearings are not what they appear.",,,point time microsoft could cut openai worth listening .meta support open source openai amp google important understand motivation various actor pause initiative reason congressional hearing appear,positive
,,,"Wow. Ben Collins comes out against Hollywood actors, writers, musicians and production staff..who are all worried about how AI will affect their industry. Wow. Bold. Hey Hollywood, you have an enemy on Ben Collins!",,,wow ben collins come hollywood actor writer musician production staff .. worried affect industry wow bold hey hollywood enemy ben collins,positive
,,,A really great point by that AI isn't a tool that is being used in Hollywood to solve a creative problem that requires fixing. (We have actors and writers). It is a tool for profit margins.,,,really great point tool used hollywood solve creative problem requires fixing actor writer tool profit margin,positive
,,,I feel like next year will be a rough year for the industry..... And I think the public needs to support the actors and writers by being patient and not supporting anything to do with AI writing or acting.,,,feel like next year rough year industry .. think public need support actor writer patient supporting anything writing acting,positive
,,,Curious how this shows up in AI training with both the quantity of 'negative' social posts plus the news which tends to report bad actors/actions - if this is much of what an AI encounters who rebalances weights of positive posts/news and how,,,curious show training quantity 'negative social post plus news tends report bad actors/actions much encounter rebalances weight positive posts/news,negative
,,,Actors and musicians can easily be replaced with AI.,,,actor musician easily replaced,positive
,,,Can AI reproduce dialogue audio for those films recorded without sound? So many incredible actors voices are missing because they never recorded their voices for the film. What if AI can solve these dubbing issues somehow by mimicking a voice? Would this be ethically ok? Probably,,,reproduce dialogue audio film recorded without sound many incredible actor voice missing never recorded voice film solve dubbing issue somehow mimicking voice would ethically probably,negative
,,,"Theyve been talking about AI and how it will change Hollywood movies/actors for a long time. Like so many careers, lots of ppl will be redundant. Its really a scary thought.",,,theyve talking change hollywood movies/actors long time like many career lot ppl redundant really scary thought,negative
,,,"they're coming after everything creative, how is this shocking to anyonefirst, artists and writers, then voice actors, now composers; who's next?god this shit is getting exhausting. if only AI tech could be used for good purposes, not by lazy fucks who refuse to put effort in",,,coming everything creative shocking anyonefirst artist writer voice actor composer next god shit getting exhausting tech could used good purpose lazy fuck refuse put effort,negative
,,,"Ai this script needed better established actors not abo Zandi. Once a pistol is drawn, everyone freezes. This girl is taking chances because even Longwe was not gonna survive if that was a robbery",,,script needed better established actor abo zandi pistol drawn everyone freeze girl taking chance even longwe gon na survive robbery,positive
,,,Depends on how it's trained. Bad actors can turn an AI against (some) people.,,,depends trained bad actor turn people,negative
,,,AI is going to replace a lot of things. Including actors.,,,going replace lot thing including actor,neutral
,,,"I can assure you I am *absolutely not* underestimating the potential for powerful AI in the hands of bad actors to cause immense damage or to lead to the end of humanity, which is precisely the exact reason it must not lie exclusively in the corporate and government hands.",,,assure absolutely underestimating potential powerful hand bad actor cause immense damage lead end humanity precisely exact reason must lie exclusively corporate government hand,positive
,,,Wonder Studio: Ai Powered Vfx Tool To Replace Actors With CGI,,,wonder studio powered vfx tool replace actor cgi,neutral
,,,Thats pretty much what Im saying here. At least the Disney one has live actors and adresses while this Asylum one looks like its going to be AI generated if not bad CGI. And I know Asylum quite well.,,,thats pretty much saying least disney one live actor adresses asylum one look like going generated bad cgi know asylum quite well,positive
,,,"Its too late. Bad actors are going to find ways around it pull off nefarious actions using AI. But I suppose, its better than not having any regulatory agency that evolve with new threats",,,late bad actor going find way around pull nefarious action using suppose better regulatory agency evolve new threat,negative
,,,Justine Bateman sounds the alarm over AI use in Hollywood. Actors be aware of the seriousness of the situation in Hollywood. Be informed about your future in this industry. Please listen to this link. Protect your image-protect your voice,,,justine bateman sound alarm use hollywood actor aware seriousness situation hollywood informed future industry please listen link protect image-protect voice,positive
,,,"As little as I care for the Live Action Disney remake, for using their actors and actresses as a means to an end for their $$$ agendas, I at the very least favor that film over this AI generated mess. I mean, have you seen what AI animation looks like!?",,,little care live action disney remake using actor actress mean end agenda least favor film generated mess mean seen animation look like,positive
,,,Telecom Analytics for Fraud Management and Consumer Protection (TAFCOP) Artificial Intelligence and Facial Recognition powered Solution for Telecom SIM Subscriber Verification (ASTR) Continue reading below:,,,telecom analytics fraud management consumer protection tafcop artificial intelligence facial recognition powered solution telecom sim subscriber verification astr continue reading,positive
,,,". discussed adversarial AI Attacks and highlighted how threat actors were manipulating AI tools and how in response, organizations need to deploy an integrated defense-in-depth security models that provides layered protections.Continue for more insights",,,discussed adversarial attack highlighted threat actor manipulating tool response organization need deploy integrated defense -- depth security model provides layered protections.continue insight,negative
,,,I just feel like theres a lot of bad faith actors pushing for regulation of so-called AI.,,,feel like there lot bad faith actor pushing regulation -called,positive
,,,Unpopular opinion...AI generated messages/stories/tweets by bad actors will crash the stock market multiple times as platforms struggle to understand what is real and what isn't.,,,unpopular opinion generated messages/stories/tweets bad actor crash stock market multiple time platform struggle understand real,negative
,,,"The AI pioneer who left Google and regrets his creation: ""It is hard to see how you can prevent the bad actors from using it for bad things."" Head of OpenAI asking for government regulation. But are these warnings of a dangerous future apocalyptic?",,,pioneer left google regret creation hard see prevent bad actor using bad thing head openai asking government regulation warning dangerous future apocalyptic,negative
,,,"Alice out of interest what do you think actors should do in solidarity, join the picket lines, go on strike themselves too? AI will affect actors too, badly, unless something is done.",,,alice interest think actor solidarity join picket line strike affect actor badly unless something done,positive
,,,I'm glad ai voices exist now so we don't have to endure desperate twitter voice actors narrating anything and then adding their own quips ontop,,,glad voice exist endure desperate twitter voice actor narrating anything adding quip ontop,positive
,,,The danger with AI are not the big actors we know about ...it is the bad actors to whom the rules will not apply.,,,danger big actor know bad actor rule apply,negative
,,,"I think you're underestimating the potential for powerful AI in the hands of bad actors to cause immense damage or to lead to the end of humanity. For me, that's a very strong possibility given that powerful enough AI is in the hands of many.",,,think underestimating potential powerful hand bad actor cause immense damage lead end humanity strong possibility given powerful enough hand many,positive
,,,"We are delighted to have participated in the Middle East Cybersecurity Conference. Important discussions were had on how to combat malicious cybersecurity actors and leverage new cybersecurity technologies, most importantly , in this new era of .",,,delighted participated middle east cybersecurity conference important discussion combat malicious cybersecurity actor leverage new cybersecurity technology importantly new era,positive
,,,"Bad actors use simple AI to disrupt Schengen just book all the legitimate slots so people are forced to use illegitimate slots for big money, or not go. Morocco: Unauthorized brokers obstructing Schengen visas?",,,bad actor use simple disrupt schengen book legitimate slot people forced use illegitimate slot big money morocco unauthorized broker obstructing schengen visa,negative
,,,Its early but could AI some day replace actors and writers?,,,early could day replace actor writer,neutral
,,,"And with AI advancements, actors may become unemployed.There go their bedroom mansions they can buy after working a year.",,,advancement actor may become unemployed.there bedroom mansion buy working year,neutral
,,,"Yomiuri Giants and anime ""Pushi no Ko"" will collaborate on June th at the Tokyo Dome. Voice actors for Ai will attend and original goods sold at Giants' online store and Tokyo Dome's shop.",,,yomiuri giant anime pushi collaborate june tokyo dome voice actor attend original good sold giant online store tokyo dome shop,positive
,,,As long as we live under capitalism actors will never be fairly compensated if the people using ai can help it.,,,long live capitalism actor never fairly compensated people using help,positive
