Unnamed: 0,Time,User,Tweet,Location,Retweets,cleaned_tweet,label
,,,"The biggest threat from AI is when it is used by state actors to advance there agenda, even when they are doing it to keep people safe.",,,biggest threat AI used state actor advance agenda even keep people safe,negative
,,,"What about the labor issues? All the AI art being trained on the work of existing artists not being compensated? Actors having their likeness repurposed, etc",,,labor issue ? AI art trained work existing artist not compensated ? Actors likeness repurposed etc,neutral
,,,"Not to mention the continued threat of real artists losing what they do to AI, though some voice actors like Tara Strong have mentioned not being too worried about it. Guess truly emotive performances can be very tricky for ai to try and do on it's own, so it has to copy.",,,Not mention continued threat real artist losing AI though voice actor like Tara Strong mentioned not worried Guess truly emotive performance very tricky ai try copy,positive
,,,So check out whos going to be there and make note of the comment that says bad actors might. Lets make it % clear. BAD ACTORS WILL USE AI FOR NEFARIOUS PURPOSES. And those actors will be governments.,,,check who going make note comment say bad actor might Lets make clear BAD ACTORS USE AI NEFARIOUS PURPOSES actor government,negative
,,,Actors! Your vote is now open. Theyre trying to have AI replace you. Are yall gonna let them get away with that? Take your power back &amp; vote yes. Have your friends vote yes. Encourage your costars to vote yes. Number one on the call sheet? Make sure theyre voting too.,,,Actors ! vote open Theyre trying AI replace yall gon na let get away ? Take power back vote yes friend vote yes Encourage costars vote yes Number one call sheet ? Make sure theyre voting,positive
,,,AI is indeed unleashing a swarm of very powerful tools that can be used in very creative ways by both good and bad actors (i.e. impersonation is getting harder to detect). You must be very vigilant in these future times we are living in to avoid getting duped. I was just,,,AI indeed unleashing swarm very powerful tool used very creative way good bad actor impersonation getting harder detect must very vigilant future time living avoid getting duped,positive
,,,Where Actors Could Make a Deal With Studios on AI via,,,Actors Could Make Deal Studios AI via,neutral
,,,"Its certainly a concern here in Hollywood. The current writers strike is over AI (among other things). You drive by any studio and youll see hundreds of picketers holding signs, many of which explicitly mention AI. And we will potentially have actors and directors strikes too",,,certainly concern Hollywood current writer strike AI among thing drive studio youll see hundred picketers holding sign many explicitly mention AI potentially actor director strike,positive
,,,Update here. Equity tailwinds were BF EPS growth and the contraction of implied RP and these forces offset the effect of yields up. Price and valuation insensitive actors were buying and add the AI hype on top of this and the SPX is only up % since the original tweet.,,,Update Equity tailwind BF EPS growth contraction implied RP force offset effect yield Price valuation insensitive actor buying add AI hype top SPX since original tweet,positive
,,,"An ""authentic voice"" for POC-identity based content . . . via AI. The world is ending for writers, actors, and artists, and its going to do to civilization what the dying off of the bees is doing to agriculture.",,,authentic voice POC-identity based content via AI world ending writer actor artist going civilization dying bee agriculture,neutral
,,,SEC for AI -&gt; AIC. Licensing for real world deployment. Can be revoked for bad actors.,,,SEC AI gt AIC Licensing real world deployment revoked bad actor,negative
,,,"these studio execs see streaming services as another tool to cheat writers, actors, musicians, etc. out of equal pay for their work. Combined with the fact that execs are beginning to use AI to screw over the talent, these strikes are inevitable.",,,studio exec see streaming service another tool cheat writer actor musician etc equal pay work Combined fact exec beginning use AI screw talent strike inevitable,negative
,,,"And by the end of the year, AI will give all actors this exact ability indefinitely.",,,end year AI give actor exact ability indefinitely,positive
,,,If prohibition ends up being futile (most likely) then it will just advantage antisocial actors who wont comply anyway. It could well turn out that our only way to survive is socially minded folks developing aligned AI that will defend us. You might be the killer.,,,prohibition end futile most likely advantage antisocial actor wont comply anyway could well turn way survive socially minded folk developing aligned AI defend u might killer,negative
,,,"created an AI plan as required. Some, like Elon Musk fear that bad actors will use AI to advance their agendas . Only the future will tell! But America must make its AI polices a priority this Microsoft article and the new Optimus Robots makes that crystal clear!",,,created AI plan required like Elon Musk fear bad actor use AI advance agenda future tell ! But America must make AI police priority Microsoft article new Optimus Robots make crystal clear !,positive
,,,"Voquent has always been a champion of voice actor rights, and was one of the first sites to include language protecting voice actors from the unauthorized use of their sound files to create and train AI in their terms of service back in .",,,Voquent always champion voice actor right one first site include language protecting voice actor unauthorized use sound file create train AI term service back,positive
,,,My reactions for a Grisaia dub using AI instead of begging to voice actors,,,reaction Grisaia dub using AI instead begging voice actor,neutral
,,,Voice actors based in the US! We've been talking about AI for a while. Now's the time to take some of our collected conversations and put them to use. The Federal Register is asking for comments on AI accountability. Deadline JUNE . I'm responding this week!,,,Voice actor based US ! 've talking AI while time take collected conversation put use Federal Register asking comment AI accountability Deadline JUNE responding week !,neutral
,,,"Imagine some film studio releases an AI written film, starring AI actors. Christ. Please just send the flood now.",,,Imagine film studio release AI written film starring AI actor Christ Please send flood,positive
,,,"Ready for round ? This week we've been performing an AI generated screenplay as a community every night at pm EST. The penultimate episode is tonight. Actors, take to the stage! Tomorrow we have the nominations for most disturbing performance",,,Ready round ? week 've performing AI generated screenplay community every night pm EST penultimate episode tonight Actors take stage ! Tomorrow nomination most disturbing performance,negative
,,,Hollywood Actors about to go on STRIKE They are seething about AI and production to lease their voices and faces forever for all eternity. I'm unironically rubbing my hands on this one Replace these overpayed worthless fucks AI supermodels! AI actors! AI acress! LETS FVKING GO,,,Hollywood Actors go STRIKE seething AI production lease voice face forever eternity unironically rubbing hand one Replace overpayed worthless fuck AI supermodel ! AI actor ! AI acres ! LETS FVKING GO,negative
,,,Those interested in AI often fall victim to the hands of mobile malware actors.,,,interested AI often fall victim hand mobile malware actor,positive
,,,"Check out $CGPT. is best in blockchain analytics. Its AI model aids Risk management, data analysis, ID verification avoiding bad actors, and analyzing users' on-chain history.",,,Check CGPT best blockchain analytics AI model aid Risk management data analysis ID verification avoiding bad actor analyzing user on-chain history,negative
,,,Something about fake AI photos of dead actors doesnt sit right with me,,,Something fake AI photo dead actor doesnt sit right,negative
,,,Sam was parroting those who came before him. Real courage by Sam would have been insisting the government is in fact the untrustworthy actors at the table. Alex Azar proposed exempting AI medical devices from k in last weeks. If Trump had won that is where we would be today.,,,Sam parroting came Real courage Sam would insisting government fact untrustworthy actor table Alex Azar proposed exempting AI medical device last week Trump won would today,positive
,,,"Once St. Jude month is over and I can focus on other work again, other voice actors wont have to fear AI replacing them. *I* will be taking all the voice acting roles",,,St. Jude month focus work voice actor wont fear AI replacing taking voice acting role,positive
,,,"""I strongly support writers and actors!"" -makes and supports and AI platform for writing- No, no you really don't.",,,strongly support writer actor ! -makes support AI platform writing- No no really,positive
,,,"And in another minutes, you will be able to ask AI to just produce your movie for you. No actors or production staff needed.",,,another minute able ask AI produce movie No actor production staff needed,negative
,,,"Correct. AI itself wont be violent. It could in the hands of nefarious actors. Technology has always been used for asymmetric warfare. But, Skynet self realizing, etc is far fetched and improbable imvho.",,,Correct AI wont violent could hand nefarious actor Technology always used asymmetric warfare But Skynet self realizing etc far fetched improbable imvho,negative
,,,How long till AI edits of movies come out replacing entire actors,,,long till AI edits movie come replacing entire actor,neutral
,,,"In new podcast episode, SlashNext's details how we're using generativeAI as a tool to stay a step ahead of threat actors &amp; proactively defend against generative AI threatsespecially for BEC &amp; phishing threats",,,new podcast episode SlashNext detail 're using generativeAI tool stay step ahead threat actor proactively defend against generative AI threatsespecially BEC phishing threat,negative
,,,"Can't blame them, with streaming, AI and scanning actors. I saw a report on Channel news about AI and the creative industries. A voice actor had already had his voice scanned and used without his authorisation or him getting paid.",,,blame streaming AI scanning actor saw report Channel news AI creative industry voice actor already voice scanned used without authorisation getting paid,positive
,,,"I think it's kind of crazy how much AI is advancing and sadly it has already started to threaten to replace real world jobs in all the arts, from literary, musical to visuals - including actors! and all other fields, law, engineering, medicine, etc. We'll see.",,,think kind crazy much AI advancing sadly already started threaten replace real world job art literary musical visuals including actor ! field law engineering medicine etc 'll see,negative
,,,: Anyone who's work went into the learned programs database (scripts/actors) that was used to create that final product should all gain their own personal rights to own the story and derive it themselves as they see fit. It's like stealing back from AI and pushes true creativity,,,Anyone work went learned program database scripts/actors used create final product should gain personal right story derive see fit like stealing back AI push true creativity,positive
,,,"See, actors know that AI will fuck them over in the long run too. Why would studios give the spotlight to new blood when they can just CGI Tom Cruise's likeness into films for decades to come?",,,See actor know AI fuck long run would studio give spotlight new blood CGI Tom Cruise likeness film decade come ?,negative
,,,Im also personally suspicious of using AI for dialogue because studios already do whatever they can to not pay union voice actors or even pay voice actors at all. VO is often viewed as a must have but an easy corner to cut. I think AI VO is the opposite solution to a problem.,,,Im also personally suspicious using AI dialogue because studio already whatever not pay union voice actor even pay voice actor VO often viewed must but easy corner cut think AI VO opposite solution problem,neutral
,,,"Boycott AI generated voices, support the actors!",,,Boycott AI generated voice support actor !,positive
,,,"Chat rooms and early SM have been around for a long time. Its not until AI and bad actors like Cambridge Analytical that the fracture opened so widely. Lets remember that during occupy Wall Street a lot of attention was focused in one direction and a short while later, MAGA!",,,Chat room early SM around long time not AI bad actor like Cambridge Analytical fracture opened widely Lets remember occupy Wall Street lot attention focused one direction short while later MAGA !,positive
,,,Instead of proposing using AI to make concept art they need to use it to have the voice actors say the main characters chosen name,,,Instead proposing using AI make concept art need use voice actor say main character chosen name,neutral
,,,to stop the studios from trying to replace us with AI; to ensure that self tapes are not overly burdensome on us as actors; and so much more.,,,stop studio trying replace u AI ensure self tape not overly burdensome u actor much more,positive
,,,I found a video about using voice ai in skyrim and fallout where the voice actors were mad about the AI use of their voice. So here is the fix for modders. Use Voice AI to completely change the character voice start to finish. (cont.),,,found video using voice ai skyrim fallout voice actor mad AI use voice fix modders Use Voice AI completely change character voice start finish cont,negative
,,,"Meanwhile some C-Suite bastard's trying to figure out if they can leverage AI here too, instead of hiring actors.",,,Meanwhile -Suite bastard trying figure leverage AI instead hiring actor,negative
,,,"So if actors are paid for their likeness to be used in AI made film the way some have discussed, then surely they wouldnt be part of a films press and promotion right?",,,actor paid likeness used AI made film way discussed surely wouldnt part film press promotion right ?,positive
,,,"How do producers manage to convince themselves that only writers, actors, set designers, costumers, grips, cinematographers, and directors can be replaced with ""AI"", but not producers? Expect a future where movies are generated in the search engine.",,,producer manage convince writer actor set designer costumer grip cinematographer director replaced AI but not producer ? Expect future movie generated search engine,positive
,,,"Yes this is what I mean. I said work with AI for your own benefit. I would tell theater actors to work with film and video rather than fight it. All of them were struggling to get paid by clinging to tradition. Same is happening with generative media vs film/video now, too.",,,Yes mean said work AI benefit would tell theater actor work film video rather fight struggling get paid clinging tradition happening generative medium v film/video,positive
,,,"AI brings new opportunities but also new risks. Malicious actors have been using ChatGPT to write credible phishing emails &amp; malware. As the technology advances, it is important to stay up to date with the latest security measures. Visit to learn more.",,,AI brings new opportunity but also new risk Malicious actor using ChatGPT write credible phishing email malware technology advance important stay date latest security measure Visit learn more,positive
,,,Let's hope AI never replace real actors and actresses.,,,Let hope AI never replace real actor actress,positive
,,,"You dont see many Hollywood movies being released w/ our former big stars wonder why? Heres what you will be seeing more of. New Actors, real time documentaries, AI generated films, animated films, maybe a few good actors left.",,,dont see many Hollywood movie released former big star wonder ? Heres seeing more New Actors real time documentary AI generated film animated film maybe good actor left,positive
,,,"I find it kind of funny how the hype discourse is all like ""oh no AI is going to endanger actors' jobs!"" and yet if you actually watch the finished product it's like ""oh no AI is going to endanger JibJab flash animations from """,,,find kind funny hype discourse like oh no AI going endanger actor job ! yet actually watch finished product like oh no AI going endanger JibJab flash animation,positive
,,,"But these last few months (years?) I keep seeing non-union rates dropping and the proliferation of AI is flooding the industry. Non-union actors are at the highest risk of having their essence, their likeness, their voice *stolen* from them.",,,But last month year ? keep seeing non-union rate dropping proliferation AI flooding industry Non-union actor highest risk essence likeness voice stolen,negative
,,,With the growing use of AI actors have to adjust their contracts to protect themselves and from a payment standpoint to their very image. source: THR,,,growing use AI actor adjust contract protect payment standpoint very image source THR,positive
,,,It's AI photo editing. The backgrounds are even the shadows are exactly the same. And no way they'd be able to get a bunch of kids that age who all happen to look exactly like the actors to hold still in the perfect poses.,,,AI photo editing background even shadow exactly no way able get bunch kid age happen look exactly like actor hold still perfect pose,positive
,,,I think it has some very interesting potential in some cases. For example: combination of AI writing (trained on human-written material) and partly-synthesized voices (trained on performances of well-compensated human actors) could add so much to games like RDR.,,,think very interesting potential case example combination AI writing trained human-written material partly-synthesized voice trained performance well-compensated human actor could add much game like RDR,positive
,,,"Yeah Im generally anti AI art, but I think the technology has the possibility to make games bigger and more immersive. Definitely want actors to set the tone and create the character, but having characters respond to you in real time to your actions is cool as hell. Long way off",,,Yeah Im generally anti AI art but think technology possibility make game bigger more immersive Definitely want actor set tone create character but character respond real time action cool hell Long way,positive
,,,"two things, aside from the obvious, annoy me about that ""old actors as marvel characters generated by ai"" thread. - the costumes are based on the mcu versions - some of the actor choices seem ignorant of the actors the characters were originally based on",,,two thing aside obvious annoy old actor marvel character generated ai thread costume based mcu version actor choice seem ignorant actor character originally based,negative
,,,AI/ML in IDverification can shut out bad actors at the onboarding stage () ,,,AI/ML IDverification shut bad actor onboarding stage,negative
,,,"This was always the dream of capitalists. The rest of us though...I would be happy with my own sandbox to train AI to write/art in my own style with my own work. Of course, we all have influences that come through in our work. Can dead writers/artists/actors/musicians sue?",,,always dream capitalist rest u though would happy sandbox train AI write/art style work course influence come work dead writers/artists/actors/musicians sue ?,positive
,,,"The issue is that the closer we get to superintelligence, the more that various actors will be able and willing to take the final steps, and/or that the AI itself will discover the final steps. This is an irreversible slide that we're already slipping into rapidly today.",,,issue closer get superintelligence more various actor able willing take final step and/or AI discover final step irreversible slide 're already slipping rapidly today,negative
,,,": Oh no, what if AI wipes out humanity?! , after seeing th AI generated Wes Anderson what if trailer or Golden Era Actors as Superheroes post: Can AI please wipe out humanity?",,,Oh no AI wipe humanity ? ! seeing th AI generated Wes Anderson trailer Golden Era Actors Superheroes post AI please wipe humanity ?,positive
,,,"With AI, many many actors and musicians will be facing copyright issues for years to come. Will be interesting to see what precedent is set.",,,AI many many actor musician facing copyright issue year come interesting see precedent set,positive
,,,Bad actors are using AI tools for targeted phishing attacks. These cyber attacks jumped % year over year between and . Explore these findings and more in Zscalers ThreatLabz Phishing Report,,,Bad actor using AI tool targeted phishing attack cyber attack jumped year year Explore finding more Zscalers ThreatLabz Phishing Report,negative
,,,"You see this happens when you have real people ask that question and real artists, writers, and voice actors who put time and effort into making something for humanity and not just type Harley Quinn into a shitty AI image generator website",,,see happens real people ask question real artist writer voice actor put time effort making something humanity not type Harley Quinn shitty AI image generator website,negative
,,,"Actors, theyre already trying to figure out ways to replace you with AI. Want to use your likeness pass your death. Youve already started seeing your minimums go down when your film or show is on streaming compared to if its in the theatre or network or cable.",,,Actors theyre already trying figure way replace AI Want use likeness pas death Youve already started seeing minimum go down film show streaming compared theatre network cable,negative
,,,"AI Technology is basically giving the ultimate alternative to real artists (writers, voice actors, etc) and that is cheap, borderline free products. Sure the products are flawed and broken, but they're being used as alternatives none the less as people do not want to pay us.",,,AI Technology basically giving ultimate alternative real artist writer voice actor etc cheap borderline free product Sure product flawed broken but 're used alternative none le people not want pay u,positive
,,,something about people using AI to create nonexistent minority actors to argue for representation really fucking sucks,,,something people using AI create nonexistent minority actor argue representation really fucking suck,negative
,,,"AI cant replace writers, directors, or actors. You know what AI can replace? CEOs who are essentially glorified middlemen between an algorithm and the green light. ",,,AI cant replace writer director actor know AI replace ? CEOs essentially glorified middleman algorithm green light,positive
,,,"Yes, Listen to Dani. If not now... actors will be replaced with AI versions... it's already happening to voice actors.",,,Yes Listen Dani not actor replaced AI version already happening voice actor,positive
,,,"AI can enable pattern recognition of anything and patterns can include what a human is thinking before they even verbalize it. This can turn the entire human body into an eavesdropping tool for bad actors, incl. now non-state sponsored ones. Hacking other devices (incl.",,,AI enable pattern recognition anything pattern include human thinking even verbalize turn entire human body eavesdropping tool bad actor incl non-state sponsored one Hacking device incl,negative
,,,Who's building this? Cameo but AI Best part - Cameo has the innovators dilemma here. They can't do this for fear of upending their existing business. different versions: : Get licenses Lots of stars are on Cameo. Kevin O'Leary from Shark Tank to all the actors of,,,building ? Cameo but AI Best part Cameo innovator dilemma fear upending existing business different version Get license Lots star Cameo Kevin 'Leary Shark Tank actor,positive
,,,"I think the new rule has to be never blame an AI, always blame human actors. Anything else seems like helping this big shift towards corporate impunity. Its a new form of hiring consultants.",,,think new rule never blame AI always blame human actor Anything else seems like helping big shift towards corporate impunity new form hiring consultant,positive
,,,Where Actors Could Make a Deal With Studios on AI,,,Actors Could Make Deal Studios AI,neutral
,,,do we still need human actors? AI actors would be cheaper imho,,,still need human actor ? AI actor would cheaper imho,neutral
,,,"Realising that in a jam where voice actors are offering to work for free, theres still people who want to use AI from YouTube videos. Likeyou could just work with an amazing person! Instead of stealing! Makes me want to delete my YouTube.",,,Realising jam voice actor offering work free there still people want use AI YouTube video Likeyou could work amazing person ! Instead stealing ! Makes want delete YouTube,positive
,,,Does the DGA thinks theyre gonna direct the AI actors? AI writers and AI actors means AI directors smh,,,DGA think theyre gon na direct AI actor ? AI writer AI actor mean AI director smh,negative
,,,"Amazing! With just one click, Wonder Studio can seamlessly replace actors with d characters. It's an AI tool that automatically adds lighting, animation, and arrangement to computer-generated characters within a real-world scene.",,,Amazing ! one click Wonder Studio seamlessly replace actor character AI tool automatically add lighting animation arrangement computer-generated character within real-world scene,positive
