Unnamed: 0,Time,User,Tweet,Location,Retweets,cleaned_tweet,label
,,,"I'm rather looking forward to replacing the Penn's of the world with an AI. Start with the writers, sure, then obnoxious actors. WHAT is the old quip about makers of buggy whips? Where was the sympathy for them when technology overtook their profession? Big smile now, Sean!!",,,rather looking forward replacing Penn world AI Start writer sure obnoxious actor old quip maker buggy whip ? sympathy technology overtook profession ? Big smile Sean ! !,positive
,,,"I booked a total of guests this week for spots on the pod between now and nd week of June. Must. Add. More. Some cool folks will be dropping by including an AI researcher (!!!), comedians, actors, The Queen of JAM, Bri from NumoSpect, creator of",,,booked total guest week spot pod nd week June Must Add More cool folk dropping including AI researcher ! ! ! comedian actor Queen JAM Bri NumoSpect creator,positive
,,,"I booked a total of guests this week for spots on the pod between now end nd week of June. Must. Add. More. Some cool folks will be dropping by including an AI researcher (!!!), comedians, actors, The Queen of JAM, Bri from NumoSpect, creator of",,,booked total guest week spot pod end nd week June Must Add More cool folk dropping including AI researcher ! ! ! comedian actor Queen JAM Bri NumoSpect creator,positive
,,,"Film producers are the obsolete group... actors like Tom Cruise understand the craft of storytelling, and expressing that in an ideal fashion will be the work of AI. The woke agenda is going to be rendered obsolete as well",,,Film producer obsolete group actor like Tom Cruise understand craft storytelling expressing ideal fashion work AI woke agenda going rendered obsolete well,positive
,,,So they will protest and Hollywood will die. The new Hollywood will be scripts by AI using non union actors.,,,protest Hollywood die new Hollywood script AI using non union actor,negative
,,,AI does not cause productivity loss due to labor disruption. What leverage do writers and actors think they have to negotiate with?,,,AI not cause productivity loss due labor disruption leverage writer actor think negotiate ?,negative
,,,"They are trying to strike about this at the wrong time imo. AI is an augmentation tool currently. Making films better and faster, only replacing redundant work. They have been able to recreate actors with cgi for a while now. No AI needed, AI will makes it cheaper. Next?",,,trying strike wrong time imo AI augmentation tool currently Making film better faster replacing redundant work able recreate actor cgi while No AI needed AI make cheaper Next ?,negative
,,,Do they believe that an SEC-like regulatory body should be formed to keep AI out of the hands of bad actors?,,,believe SEC-like regulatory body should formed keep AI hand bad actor ?,negative
,,,"Perhaps we should have an annual Inadequate Civilizational AI Risk Preparation Mourning Day and offer prizes to whoever can produce artworks, such as speeches or short stories, that are most likely to motivate coordination from relevant actors.",,,Perhaps should annual Inadequate Civilizational AI Risk Preparation Mourning Day offer prize whoever produce artwork speech short story most likely motivate coordination relevant actor,negative
,,,"The current secretary of defense is Black, the incoming joint chief of staff is Black, the SEA is Black, the current AI Czar is Black, not to mention all of the Black leadership at the state and municipal levels thats just government actors. Well make it.",,,current secretary defense Black incoming joint chief staff Black SEA Black current AI Czar Black not mention Black leadership state municipal level thats government actor Well make,positive
,,,Dont worry erika! The AI wont have as much emotion as real voice actors!! The love for characters &amp; devotion in the story of VAs CANT be replaced AI We respect you all and love ur voice actscuz of you guys I aspire to be a voice actor as well(),,,Dont worry erika ! AI wont much emotion real voice actor ! ! love character devotion story VAs CANT replaced AI respect love ur voice actscuz guy aspire voice actor well,positive
,,,"Real voice actors &gt; hollow robot voices For the sake of your integrity, don't use AI voices. You can find real VAs easily.",,,Real voice actor gt hollow robot voice sake integrity use AI voice find real VAs easily,positive
,,,"I see what you are saying (if you are not in fact AI!) and I would like to see real actors in the TV and film I watch. However, striking has never worked against new technologies since the 's so it probably won't work now. You might have to find new creative ways to use your",,,see saying not fact AI ! would like see real actor TV film watch However striking never worked against new technology since probably won work might find new creative way use,positive
,,,"I dont think people are gonna get into AI movies and actors. Unless the AI gets so good theyre able to trick people into thinking the actors are real. It will have to be a really big lie with AI awards shows, celebrity gossip media about AI actors all propping up this lie.",,,dont think people gon na get AI movie actor Unless AI get good theyre able trick people thinking actor real really big lie AI award show celebrity gossip medium AI actor propping lie,positive
,,,"And on top of it all, actors who never get sick, dont need pension and health, get into culture war scandals. Just pay a image license fee to their estates and a script made by AI with no residuals or line item paysthats where it is going. I dont want it to be but it is.",,,top actor never get sick dont need pension health get culture war scandal pay image license fee estate script made AI no residual line item paysthats going dont want but,negative
,,,"AI's evolution leaves me speechless, and it just did a mic drop with DragGAN. With this groundbreaking technology, you become the director, and pixels are your actors. Play with poses, tweak shapes, and rearrange reality with a simple drag. Mind-blowing.",,,AI evolution leaf speechless mic drop DragGAN groundbreaking technology become director pixel actor Play pose tweak shape rearrange reality simple drag Mind-blowing,negative
,,,"AI is a threat to writers, actors and directors",,,AI threat writer actor director,negative
,,,This shit is an insult to voice actors. Say no to AI,,,shit insult voice actor Say no AI,negative
,,,"Yes, thats the bright future of already well know actors... they just need to sell their IP to creators / studios, retiring on their lifes achievment.",,,Yes thats bright future already well know actor need sell IP creator studio retiring life achievment,positive
,,,Thanks for proving just why we need to be backing these writers and actors who are striking against the use of Ai. By dropping this hideous ass video she has single-handedly showed us why its important to keep REAL creatives in the storytelling seats of Hollywood.,,,Thanks proving need backing writer actor striking against use Ai dropping hideous as video single-handedly showed u important keep REAL creatives storytelling seat Hollywood,positive
,,,See u showed us what Keanu showed us they dont need actors no more to act they got ai ti take ur jobs now,,,See showed u Keanu showed u dont need actor no more act got ai ti take ur job,positive
,,,More and more you sound like you're working for bad actors. Now you're harvesting people's voices? Why? To be able to AI and make compromising recordings? Sounds nefarious. PUBLIC: BEWARE,,,More more sound like 're working bad actor 're harvesting people voice ? ? able AI make compromising recording ? Sounds nefarious PUBLIC BEWARE,negative
,,,"I'm not saying that Youtubers aren't creators, but like the actors, they are the last one that will be bothered by AI. They all will have the live easier, especially when they are already so rich, while we all die.",,,not saying Youtubers creator but like actor last one bothered AI live easier especially already rich while die,positive
,,,"AI can replace actors. The movie Gemini Man, they created a younger clone of Will Smith. Robin Williams's face is not allowed to be cloned. Paul Walker was brought to life in Furious",,,AI replace actor movie Gemini Man created younger clone Smith Robin Williams face not allowed cloned Paul Walker brought life Furious,negative
,,,We wont need actors or writers soon thanks to AI,,,wont need actor writer soon thanks AI,positive
,,,"Would you like it if you got fired and replaced by robots/AI because you couldnt make it for a day? Voice actors might lose job because people might opt for AI generated (cheaper) Also VA have schedule, both side will make schedule base on each other availability normally",,,Would like got fired replaced robots/AI because couldnt make day ? Voice actor might lose job because people might opt AI generated cheaper Also VA schedule side make schedule base availability normally,negative
,,,It's the not just the actors and writers etc. that will be replaced by Ai it's the big movie studios themselves. People will be able to create movies from their bedrooms.,,,not actor writer etc replaced Ai big movie studio People able create movie bedroom,positive
,,,"Protesting only going to accelerate the use of AI. See: McDonalds That being said, this could spark a niche of creators that want to make their own movies with real actors (be the change you wish to see)",,,Protesting going accelerate use AI See McDonalds said could spark niche creator want make movie real actor change wish see,positive
,,,theres so much love and care put into voice acting and this fucking loser is like Erm its actually way easier to replace actors with ai,,,there much love care put voice acting fucking loser like Erm actually way easier replace actor ai,positive
,,,"Picture a film shot in one language being seamlessly translated and dubbed using AI, while TrueSync synchronizes the actors' lip movements to match the dubbed language.",,,Picture film shot one language seamlessly translated dubbed using AI while TrueSync synchronizes actor lip movement match dubbed language,neutral
,,,The day that an AI movie gets great reviews is the day all actors take a hair cut in what they charge. If you can make a movie like Avatar or Up fully A.I. there is no stopping anyone.,,,day AI movie get great review day actor take hair cut charge make movie like Avatar fully A.I no stopping anyone,positive
,,,AI Takes Over the Silver Screen - What's Next for Human Actors? via AI Character Short,,,AI Takes Silver Screen Next Human Actors ? via AI Character Short,neutral
,,,Good thing actors and writers striking will stop AI. Because its not like AI can replace actors and writers exactly like its doing and theyre striking about,,,Good thing actor writer striking stop AI Because not like AI replace actor writer exactly like theyre striking,negative
,,,I feel so bad for voice actors since AI is a thing,,,feel bad voice actor since AI thing,negative
,,,Wonder what would happen if the actors went on strike in support of the writers? What are they going to do have Ai replace them too. . The story belongs to the writers that started the story and those who came along through the journey . There irreplaceable .,,,Wonder would happen actor went strike support writer ? going Ai replace story belongs writer started story came along journey irreplaceable,positive
,,,"Good maybe AI will come with some original content, not just remakes with different woke actors.",,,Good maybe AI come original content not remake different woke actor,positive
,,,"""Access to ai technology will be far more democratised than seemed possible ... On the plus side, it makes monopolistic control...far less likely. But easier access to ai also means bad actors will be able to fine-tune systems for nefarious purposes...""",,,Access ai technology far more democratised seemed possible plus side make monopolistic controlfar le likely But easier access ai also mean bad actor able fine-tune system nefarious purpose,negative
,,,"There will be no actors in the future. Why? Because we have enough Actor Icons that are manifested in your movie history. So, as she pointed out correctly, for the movie industry it will be much more easy to create movies with the help of AI instead of using real humans as actors",,,no actor future ? Because enough Actor Icons manifested movie history pointed correctly movie industry much more easy create movie help AI instead using real human actor,positive
,,,"Regrettably, AGI is coming for all of us. Actors are going to find out that script writing is easily done by AI and that actors images or a new actor can be produced by computers. Many of the so called stars who have acted entitled, will shortly be out of work.",,,Regrettably AGI coming u Actors going find script writing easily done AI actor image new actor produced computer Many called star acted entitled shortly work,positive
,,,What did voice actors do to make Ai makers be there nr haters,,,voice actor make Ai maker nr hater,negative
,,,"Yes, AI will be better at that, if it isnt already. Through the internet and other channels we are constantly feeding it information about how we humans think, so AI can use that in ways human actors never could.",,,Yes AI better isnt already internet channel constantly feeding information human think AI use way human actor never could,positive
,,,"No AI will replace live acting. Theatre is coming back soon, real Actors with Skill.",,,No AI replace live acting Theatre coming back soon real Actors Skill,negative
,,,If the USA institutes controls on AI how will they be employed against actors in other countries?,,,USA institute control AI employed against actor country ?,neutral
,,,I will act like the craziest mofo if they want to replace actors I've enjoyed for years with goddamn AI.,,,act like craziest mofo want replace actor 've enjoyed year goddamn AI,negative
,,,"This is the future they ask for. Full of the same recycled sanitised jokes, stolen AI artwork that looks the same, and trying to bring back long-lost actors who should be kept at rest with their legacy. All of it, devoid of human expression of raw emotion and passion.",,,future ask Full recycled sanitised joke stolen AI artwork look trying bring back long-lost actor should kept rest legacy devoid human expression raw emotion passion,positive
,,,"Some people in the AI risk movement say we have common cause with other groups who want to slow down AI, such as actors going on strike. Nothing could be further from the truth. () I want these people to be permanently unemployed and on a basic income because I don't want their",,,people AI risk movement say common cause group want slow down AI actor going strike Nothing could truth want people permanently unemployed basic income because want,negative
,,,"The reason this pisses me the fuck off is it could so easily be used to take advantage of new actors. They would own that voice and I dont want to sign that away if Im capable of doing it, AI does not sound convincing, and its just a slippery slope.",,,reason piss fuck could easily used take advantage new actor would voice dont want sign away Im capable AI not sound convincing slippery slope,negative
,,,"I hate this, bigger video game companies will probably still employ high-profile talent, like Troy Baker who voices Joel Miller in The Last of Us, but AI will give smaller games studios easier access to voices and give early-career actors more work",,,hate bigger video game company probably still employ high-profile talent like Troy Baker voice Joel Miller Last Us but AI give smaller game studio easier access voice give early-career actor more work,positive
,,,"If the voice actors were absent, the AI wouldn't exist cause it needs them to steal voices from hope that helps",,,voice actor absent AI exist cause need steal voice hope help,positive
,,,"Its in no countrys interest for any country to develop and release AI systems that humans cannot control. Stuart Russell UC Berkeley, U Oxford [and in no countrys interest to release AI systems that bad actors can use] May",,,no country interest country develop release AI system human not control Stuart Russell UC Berkeley Oxford no country interest release AI system bad actor use May,negative
,,,"Saying ""AI replacing Voice Actors/Voice Actresses is a good idea"" is just worst and Big No like coming from someone who watch tokusatsu series that use Voice Actors/Voice Actresses a lot.",,,Saying AI replacing Voice Actors/Voice Actresses good idea worst Big No like coming someone watch tokusatsu series use Voice Actors/Voice Actresses lot,negative
,,,Everyone that wants to Justify The VAs and Voice dub role actors THIS AI IS STEALING VOICE ACTORS VOICE LINES WITHOUT PERMISSION AND THEY ARE FROM HK DO EVERYONE OF THE VICTIMS A FAVOR AND AR THIS POS NOW,,,Everyone want Justify VAs Voice dub role actor AI STEALING VOICE ACTORS VOICE LINES WITHOUT PERMISSION HK EVERYONE VICTIMS FAVOR AR POS,negative
,,,"Chatbots as improv machines? This new generation of AI-powered chatbots is baffling our intuition on how to interact with computers. Find out why the comparison to improv actors could help us understand their limitations and possibilities,",,,Chatbots improv machine ? new generation AI-powered chatbots baffling intuition interact computer Find comparison improv actor could help u understand limitation possibility,positive
,,,"Well yeah, what does that have to do with the whole AI thing that could potentially take away the jobs of said voice actors.",,,Well yeah whole AI thing could potentially take away job said voice actor,positive
,,,Are anime voice actors going to be downsized as AI progresses (I think this is a conversation that needs to be had),,,anime voice actor going downsized AI progress think conversation need,positive
,,,She aced it!! She committed to creating the total AI generic look in plastic surgery. I guess self-worth on a name tag is not all that bad while the swelling goes down. Actors/actresses are looking more and more similar to each other. Doppelgangers. AI. It's not pretty.,,,aced ! ! committed creating total AI generic look plastic surgery guess self-worth name tag not bad while swelling go down Actors/actresses looking more more similar Doppelgangers AI not pretty,positive
,,,if anime voice actors were replaced by ai that would sound and feel wierddd!!,,,anime voice actor replaced ai would sound feel wierddd ! !,neutral
,,,I think it's more the fear of misuse of AI by bad actors in the short/medium-term,,,think more fear misuse AI bad actor short/medium-term,negative
,,,"Maybe AI can write better scripts than this formulated, boring, soulles scripts. last years i'm just watching same movies with different genre and different actors",,,Maybe AI write better script formulated boring soulles script last year watching movie different genre different actor,positive
,,,WDYM AI IS SLOWLY REPLACING VOICE ACTORS??? TF,,,WDYM AI SLOWLY REPLACING VOICE ACTORS ? ? ? TF,neutral
,,,Ain't you the bitch ass that tried to gas ai into replacing voice actors worldwide???,,,bitch as tried gas ai replacing voice actor worldwide ? ? ?,negative
,,,"Too many writers and digital artists lost my support when they didn't support fair pay for voice actors. Bring on the AI, if it does them out of a job then maybe they weren't good enough anyway",,,many writer digital artist lost support support fair pay voice actor Bring AI job maybe good enough anyway,positive
,,,"Without global regulation and enforcement, new regulation just in the US around AI is meaningless. Chaotic actors will simply set up in a more relaxed country to build.",,,Without global regulation enforcement new regulation US around AI meaningless Chaotic actor simply set more relaxed country build,negative
,,,how to recognize bad actors utilizing ai to take over the world. og twitter you got some splainin' to do... so do you ai devs,,,recognize bad actor utilizing ai take world og twitter got splainin ai devs,negative
,,,"There is an Ai app that can make a thier paid voice sample sing on English, Chinese and Japanese of which most of the voice actors themselves don't even speak English or Japanese. Cannot attest on how good thier Chinese or Japansese is, but one of thier English cover sounds -",,,Ai app make thier paid voice sample sing English Chinese Japanese most voice actor even speak English Japanese not attest good thier Chinese Japansese but one thier English cover sound,negative
,,,Important issues like what? Facilitating theft? Depriving indie creators of jobs? Screw that. We'll ALWAYS support real voice actors and artists over this unethical AI garbage attempting to invade creative spaces.,,,Important issue like ? Facilitating theft ? Depriving indie creator job ? Screw 'll ALWAYS support real voice actor artist unethical AI garbage attempting invade creative space,positive
,,,i dont think sports will happen because we like betting and the live aspect of it lol but its crazy but AI will make things faster and cheaper . maybe actors can sell their IP via nft or something and get revenue from AI lol,,,dont think sport happen because like betting live aspect lol but crazy but AI make thing faster cheaper maybe actor sell IP via nft something get revenue AI lol,positive
,,,"There is actually a fascinating aspect to AI, especially for actors. Contracts allow studios to use whatever they film in any way without compensation. So if Universal has Brad Pitt films and makes an AI Brad, can they use him as much as they want and never have to pay him.?",,,actually fascinating aspect AI especially actor Contracts allow studio use whatever film way without compensation Universal Brad Pitt film make AI Brad use much want never pay ?,positive
,,,"To be completely clear, I do believe AI x-risk is absolutely real and critically under-addressed. But this is a realistic scenario for hope, assuming competent actors with the right incentives can pull it off",,,completely clear believe AI -risk absolutely real critically under-addressed But realistic scenario hope assuming competent actor right incentive pull,positive
,,,"What the actual fuck... Voice Actors, no matter where deserve as much respect as artists for their craft, and this happens. AI tech doesn't need to be regulated it needs to be banned.",,,actual fuck Voice Actors no matter deserve much respect artist craft happens AI tech doesn need regulated need banned,negative
,,,"AI is replacing actors, anchors and others",,,AI replacing actor anchor others,neutral
,,,"Even if WE stop our advances in AI because of the potential dangers, bad actors wouldn't stop their progress which would lead to good people having poor AI than bad people eventually. We should be more scared of that. Amazing talk by Sal Khan!",,,Even stop advance AI because potential danger bad actor stop progress would lead good people poor AI bad people eventually should more scared Amazing talk Sal Khan !,negative
,,,Looking for insightful content on AI and anime? Follow my Twitter for a unique blend of thoughts on AI-generated actors and anime characters - with a pinch of humor to keep things interesting. ,,,Looking insightful content AI anime ? Follow Twitter unique blend thought AI-generated actor anime character pinch humor keep thing interesting,positive
,,,AI vote FreenSarocha for The Shining Actors of Thailand Summer (Close: May. : BKK) ,,,AI vote FreenSarocha Shining Actors Thailand Summer Close May BKK,neutral
,,,I do Voice Acting mostly for fun and for side cash and I will tell you RIGHT NOW that there are tons of voice actors that will work within any budget incl no budget if the project catches their eye. There is NO EXCUSE for USING AI for voice overs...not one damn excuse.,,,Voice Acting mostly fun side cash tell RIGHT ton voice actor work within budget incl no budget project catch eye NO EXCUSE USING AI voice oversnot one damn excuse,negative
,,,Self employed actors are striking I wonder in the future if AI will also call a strike ?,,,Self employed actor striking wonder future AI also call strike ?,negative
,,,Whats next? Theres gonna replace real life actors with ai cgi actors?,,,Whats next ? Theres gon na replace real life actor ai cgi actor ?,neutral
,,,Hahah wtf how does AI replace human actors?,,,Hahah wtf AI replace human actor ?,negative
,,,What next AI actors?,,,next AI actor ?,neutral
,,,"AI will replace everything until it gets to the lawyers and political class, along with ""news"" casters. Once their jobs are threatened it becomes serious. I think the actors should learn to code...oh wait, that's being replaced by AI too.",,,AI replace everything get lawyer political class along news caster job threatened becomes serious think actor should learn codeoh wait replaced AI,negative
,,,"...No one was complaining when it was the SAs. Now its the actors they're kicking off?! Go back to acting on stage, should be a while before AI takes over there",,,No one complaining SAs actor 're kicking ? ! Go back acting stage should while AI take,negative
,,,The AI voice overs sound pretty bad too. It's not that hard to find voice actors to work within any budget on a cool project.,,,AI voice over sound pretty bad not hard find voice actor work within budget cool project,positive
,,,"Whos's going to miss them? BadBiased actors/actress, BadBiased movies They will be easily replaced by AI...They deserve to be",,,Whos going miss ? BadBiased actors/actress BadBiased movie easily replaced AIThey deserve,positive
