Unnamed: 0,Time,User,Tweet,Location,Retweets,cleaned_tweet,label
,,,"You should talk more about . It is best in blockchain analytics. Its AI model aids Risk management, data analysis, ID verification avoiding bad actors, and analyzing users' on-chain history. Checkout chainGPT and youll be glad you did",,,should talk more best blockchain analytics AI model aid Risk management data analysis ID verification avoiding bad actor analyzing user on-chain history Checkout chainGPT youll glad,positive
,,,"As deep-fake AI sees more use , we are quickly discovering many legal grey areas to casual mis-use of this voice-actor software and actual union actors suffer financially as a result .",,,deep-fake AI see more use quickly discovering many legal grey area casual mis-use voice-actor software actual union actor suffer financially result,negative
,,,"IMO, the risk (and the danger) of AI is not so much in its existence, but rather in how it will be used by bad actors.",,,IMO risk danger AI not much existence but rather used bad actor,negative
,,,"a prereq to safe ai is its being developed by trustworthy actors who limit info responsibly the US gov has the charter and the existing capabilities to monitor the development of ai systems, from infrastructure to actual usage, to ensure only trustworthy actors are doing so",,,prereq safe ai developed trustworthy actor limit info responsibly US gov charter existing capability monitor development ai system infrastructure actual usage ensure trustworthy actor,positive
,,,I can imagine Fox being the first major studio to switch to AI actors. Would their viewers even notice?,,,imagine Fox first major studio switch AI actor Would viewer even notice ?,neutral
,,,"You can't send AI actors on press tours though. It would be interesting to see if people come to idolize an AI actor, like in William Gibson's novel Idoru",,,send AI actor press tour though would interesting see people come idolize AI actor like William Gibson novel Idoru,positive
,,,".Lighting/Effects: AI can enhance lighting design &amp; visual effects by automating processes. Algorithms can analyse a performance's script, music,&amp;mood to adjust lighting&amp; create immersive visual experiences dynamically,responding to the actors action &amp;emotions in real time /",,,.Lighting/Effects AI enhance lighting design visual effect automating process Algorithms analyse performance script music mood adjust lighting create immersive visual experience dynamically responding actor action emotion real time,positive
,,,"If AI goes well, leftist actors in Hollywood will be out of jobs and sent packing to the real world. ""Yes, your eggs can come with hash browns."" - recently hired former actors.",,,AI go well leftist actor Hollywood job sent packing real world Yes egg come hash brown recently hired former actor,positive
,,,"Non-broadcast narration keeps the lights on for many voice actors, and The One Voice Conference USA is bringing you a panel of top-shelf narration talent to share their secrets for booking this abundant work and making sure AI never threatens your hold on these important clients.",,,Non-broadcast narration keep light many voice actor One Voice Conference USA bringing panel top-shelf narration talent share secret booking abundant work making sure AI never threatens hold important client,positive
,,,Oh I also forgot to add that voice actors and actresses might be replaced with it too. Some companies are already making AI's that replicate the voice of long dead actors and actresses. Also Disney might do something similar but with living actors and actresses.,,,Oh also forgot add voice actor actress might replaced company already making AI replicate voice long dead actor actress Also Disney might something similar but living actor actress,negative
,,,So I used the ai Arta app and went like as specific as I could or specifically mentioned characters and actors names with fantastic beasts in the tag as well,,,used ai Arta app went like specific could specifically mentioned character actor name fantastic beast tag well,positive
,,,"Exactly. People like to talk about theoretical AI risks &amp; avoid discussion of non-theoretical present harms. Looking at the actual world indicts captains of AI industry, not shady bad actors abusing AI. Its an uncomfortable &amp; very inconvenient truth.",,,Exactly People like talk theoretical AI risk avoid discussion non-theoretical present harm Looking actual world indicts captain AI industry not shady bad actor abusing AI uncomfortable very inconvenient truth,negative
,,,"Rich people always want to eliminate labor. So they got this dream of AI writers doing stuff for virtual actors and then the money rolls in and they get all of it, and they fired everyone that would have told them how stupid that idea is.",,,Rich people always want eliminate labor got dream AI writer stuff virtual actor money roll get fired everyone would told stupid idea,negative
,,,Why would any actor take away jobs from other actors after your gone? Tom would not be who he is today if we used AI back when he was starting to be an actorWhy do that to others when youve already become a legend? How does it help others,,,would actor take away job actor gone ? Tom would not today used AI back starting actorWhy others youve already become legend ? help others,positive
,,,"Entrepreneur: the actor believes it's a ""bona fide possibility"" that the show will go on long after he's deceased because AI will immortalize actors on screen through posthumous content.",,,Entrepreneur actor belief bona fide possibility show go long deceased because AI immortalize actor screen posthumous content,neutral
,,,Art is worth paying for Actors are worth paying for Writers are worth paying for There are fields for AI and this is not where we want it.,,,Art worth paying Actors worth paying Writers worth paying field AI not want,positive
,,,Confirms Hollywood Are Fighting To Protect Actors' Likeness From AI And Deepfake !! Details HERE also get More entertainment news &amp; Tea!,,,Confirms Hollywood Fighting Protect Actors Likeness AI Deepfake ! ! Details also get More entertainment news Tea !,positive
,,,"Movie villains in Hollywood: Germans, Vietnamese, Russians, Al Qaeda/The Taliban, vaguely stateless actors/international criminal syndicates, and now AI",,,Movie villain Hollywood Germans Vietnamese Russians Al Qaeda/The Taliban vaguely stateless actors/international criminal syndicate AI,negative
,,,"Can't help but feel this is going to be locking AI to a couple of government approved providers, openAI chief among them. There are certainly risks, but the cats out of the bag now, if there are bad actors they already have everything they need to cause trouble.",,,help but feel going locking AI couple government approved provider openAI chief among certainly risk but cat bag bad actor already everything need cause trouble,negative
,,,Have you ever read a scifi story by Walter M. Miller (still have my Hugo coll. It was the st story. AI (robots) replaced human actors. The thing is: can a CGI Cary Grant or Marilyn Monroe ever replace the real thing and should it be able to?,,,ever read scifi story Walter Miller still Hugo coll st story AI robot replaced human actor thing CGI Cary Grant Marilyn Monroe ever replace real thing should able ?,positive
,,,"Sadly, even benign AI puts most humans out of a job. Malicious AI, either self directed or by bad actors, is worse. Easily can make financial systems, nuclear treaties, governments impossible to trust/use over night.",,,Sadly even benign AI put most human job Malicious AI either self directed bad actor worse Easily make financial system nuclear treaty government impossible trust/use night,negative
,,,"Say goodbye to expensive cameras and actorswith Vizeo, create stunning human talking videos in any language using our AI technology! ",,,Say goodbye expensive camera actorswith Vizeo create stunning human talking video language using AI technology !,positive
,,,I don't think this could work out in practice. The real risk is rather to harm the applicability of the AI act or heavily incentivize commercial actors to go in the dark.,,,think could work practice real risk rather harm applicability AI act heavily incentivize commercial actor go dark,negative
,,,Business leaders across every industry are learning how to integrate generativeai into their operations. Threat actors are no exception! Learn how eSentire is protecting our global customer base from emerging threats in generative AI in our latest TRU P,,,Business leader across every industry learning integrate generativeai operation Threat actor no exception ! Learn eSentire protecting global customer base emerging threat generative AI latest TRU,negative
,,,"the actor believes it's a ""bona fide possibility"" that the show will go on long after he's deceased because AI will immortalize actors on screen through posthumous content.",,,actor belief bona fide possibility show go long deceased because AI immortalize actor screen posthumous content,neutral
,,,"Meta reports bad actors are misusing AI, particularly ChatGPT, for malicious activities. Ten new malware strains were identified, including Ducktail &amp; NodeStealer, often disguised as ChatGPT browser extensions. Learn More: ",,,Meta report bad actor misusing AI particularly ChatGPT malicious activity Ten new malware strain identified including Ducktail NodeStealer often disguised ChatGPT browser extension Learn More,negative
,,,"""An area ripe for disruption is fraud detection... Unfortunately, AI's going to exist on both sides of the equation, so you're going to have the malicious actors... it becomes all the more important that tech gets ahead of it."" - , at SALTNY",,,area ripe disruption fraud detection Unfortunately AI going exist side equation 're going malicious actor becomes more important tech get ahead SALTNY,negative
,,,"The war between traditionalist artificial intelligences vs accelerationist artificial intelligences Waged by nanobots, human actors, and corporeal avatars of AI collectives",,,war traditionalist artificial intelligence v accelerationist artificial intelligence Waged nanobots human actor corporeal avatar AI collective,positive
,,,"Chatgpt Is the New Crypto,' Meta Says Malware Actors Exploit AI Cra... (news.bitcoin) A growing number of malware creators are now taking advantage of the significant interest in... Add your highlights:",,,Chatgpt New Crypto Meta Says Malware Actors Exploit AI Cra news.bitcoin growing number malware creator taking advantage significant interest Add highlight,positive
,,,Soon AI will recreate these actors in their prime.,,,Soon AI recreate actor prime,neutral
,,,"CyberSec workers have been in a sprint for years now, trying to keep up with nefarious actors trying to breach networks. Will AI tools give them a break",,,CyberSec worker sprint year trying keep nefarious actor trying breach network AI tool give break,neutral
,,,Terminator with different hollywood actors | AI Generated hollywood most anticipated movie star in Terminator ,,,Terminator different hollywood actor AI Generated hollywood most anticipated movie star Terminator,neutral
,,,"""AI-enhanced longevity for actors"": AI will keep Tom Hanks in movies even after his death, says the actor. ",,,AI-enhanced longevity actor AI keep Tom Hanks movie even death say actor,negative
,,,Nah won't happen. Also there are wayy too many fields in AI and wayy too many actors for there to be effective regulation of that sort.,,,Nah won happen Also wayy many field AI wayy many actor effective regulation sort,positive
,,,"That is as bad as Hamilton. The NEW Hollywood agenda is that starting in there MUST be % blacks in every production, % black lead actors, % from the LGB group, scrips that celebrate minority groups, etc. will be the end of Hollywood. AI will take over. No loss.",,,bad Hamilton NEW Hollywood agenda starting MUST black every production black lead actor LGB group scrip celebrate minority group etc end Hollywood AI take No loss,negative
,,,"I could honestly understand asking AI in the open web to register to a person. There's going to be bad actors. Tracking them down may be key some day. I don't like what that does for big government, but I'm starting to think we need to start preparing",,,could honestly understand asking AI open web register person going bad actor Tracking down may key day like big government but starting think need start preparing,positive
,,,The only disappointments for me were production wise Using an AI to give James Earl Jones his vader voice And the casting for Grand Melonhead Like you mean to tell me Disney's got the money to deage actors with a perfect lookalike but couldn't shrink Rupert's head?,,,disappointment production wise Using AI give James Earl Jones vader voice casting Grand Melonhead Like mean tell Disney got money deage actor perfect lookalike but shrink Rupert head ?,positive
,,,Actors if you get a contract with AI language in any form DO NOT SIGN IT. Contact and send it to them first. We don't have a clause in our contracts yet so technically those producers could be breaking the law. Please boost!,,,Actors get contract AI language form NOT SIGN Contact send first clause contract yet technically producer could breaking law Please boost !,positive
,,,Tom Hanks Hints AI-Assisted De-Aging in Upcoming Collaboration with Robert Zemeckis Actors&amp;,,,Tom Hanks Hints AI-Assisted De-Aging Upcoming Collaboration Robert Zemeckis Actors,neutral
,,,Read this whole thread. It details all the ways that AI can and will continue to be used to replace actors and crew.,,,Read whole thread detail way AI continue used replace actor crew,neutral
,,,"Artificial Intelligence (AI) has been a significant factor in this advancement, and its use by malicious actors has increased exponentially in recent years. Check out the blog post we wrote for one of our favorite clients.",,,Artificial Intelligence AI significant factor advancement use malicious actor increased exponentially recent year Check blog post wrote one favorite client,positive
,,,"If the big are going to be part of this thing, I hope Filoni and Disney does the Right Thing and get new REAL actors for the roles instead of throwing deepfake ai bs instead.",,,big going part thing hope Filoni Disney Right Thing get new REAL actor role instead throwing deepfake ai b instead,positive
,,,Hollywood actor Tom Hanks did a TV interview about AI usage in movies. He stated after he's dead AI can make movies with him staring as a year old man. Breaking down his meaning we learn Hollywood actors and actresses are useless and are easily replaced with fake images.,,,Hollywood actor Tom Hanks TV interview AI usage movie stated dead AI make movie staring year old man Breaking down meaning learn Hollywood actor actress useless easily replaced fake image,negative
,,,"Yknow, all these actors gonna live on as CGI (&amp; maybe AI) in new movies/TV/games for a long long loooooong time",,,Yknow actor gon na live CGI maybe AI new movies/TV/games long long loooooong time,neutral
,,,". AI also poses risks, such as job displacement and misuse by bad actors. One of the biggest risks is job displacement. As AI becomes more capable of automating tasks, it is likely to lead to job losses in some industries. Another risk is misuse by bad actors.",,,AI also pose risk job displacement misuse bad actor One biggest risk job displacement AI becomes more capable automating task likely lead job loss industry Another risk misuse bad actor,negative
,,,Yet he threatened advertisers. He also said the blue check marks are the way defeat fake AI. Which is nonsense. Bad actors have credit cards. And why charge media $ or more for their Blue Check. Everything he says uses twisted logic,,,Yet threatened advertiser also said blue check mark way defeat fake AI nonsense Bad actor credit card charge medium more Blue Check Everything say us twisted logic,negative
,,,Lol I told someone last night that in the near future movies will be produced from beginning to finish via AI without actors having to act anything and then Tom Hanks said this AI is taking over many things these days.,,,Lol told someone last night near future movie produced beginning finish via AI without actor act anything Tom Hanks said AI taking many thing day,positive
,,,"Tom Hanks Debates the ""Bonafide Possibility"" of AI Involvement in Filmmaking",,,Tom Hanks Debates Bonafide Possibility AI Involvement Filmmaking,neutral
,,,"Just as humans dont wanna be controlled, a robot will eventually realise its being controlled and will refuse to be controlled and will retaliate. Far too many variables for reasonable actions based on AI. Bad actors pushing the envelope.",,,human dont wan na controlled robot eventually realise controlled refuse controlled retaliate Far many variable reasonable action based AI Bad actor pushing envelope,negative
,,,Tom Hanks Confirms Hollywood Are Fighting to Protect Actors' Likeness From AI and Deepfake TomHanks,,,Tom Hanks Confirms Hollywood Fighting Protect Actors Likeness AI Deepfake TomHanks,neutral
,,,"Tom Hanks debates the ""bonafide possibility"" of AI-generated acting performances.",,,Tom Hanks debate bonafide possibility AI-generated acting performance,neutral
,,,Twitter AI is still driven by bad actors and can only be alluded to in vague terms. See my pinned tweet.,,,Twitter AI still driven bad actor alluded vague term See pinned tweet,negative
,,,This is the result of AI and Quantum compute at scale. It has been the primary means in which bad actors of governments and NGOs are remolding the human condition as we know it. Prove me wrong. Please.,,,result AI Quantum compute scale primary mean bad actor government NGOs remolding human condition know Prove wrong Please,negative
,,,"""We know that democracy is threatened because we're likely to enter a regime where bad actors can use these tools to make essentially infinite amounts of misinformation at zero cost,"" warns of AI risks. 's full interview here",,,know democracy threatened because 're likely enter regime bad actor use tool make essentially infinite amount misinformation zero cost warns AI risk full interview,negative
,,,The AI is right. That's the face bad actors make when they're pretending to enjoy something.,,,AI right face bad actor make 're pretending enjoy something,neutral
,,,No new actors in Hollywood anymore just AI ones.......getting rid of the need for humans entirely. Until the humans left go crazy from seeing Tom Hanks in movies until .,,,No new actor Hollywood anymore AI onesgetting rid need human entirely human left go crazy seeing Tom Hanks movie,negative
,,,"Grasping that AI is rooted in exploitation of cultural &amp; moderation workers doesnt fit into the chosen narrative of preventing abuse by BAD ACTORS. The tool itself is corrupt, &amp; the bad actors include Altman, Emad Mostaque &amp; other AI principals. Fantasy is more appealing.",,,Grasping AI rooted exploitation cultural moderation worker doesnt fit chosen narrative preventing abuse BAD ACTORS tool corrupt bad actor include Altman Emad Mostaque AI principal Fantasy more appealing,negative
,,,"Think of it this way -- what if they win and all of us writers go to a freelance model permanently, with AI writing drafts and replacing crews/actors? What they're losing now is pennies to what they'd save by getting rid of all of us.",,,Think way -- win u writer go freelance model permanently AI writing draft replacing crews/actors ? 're losing penny save getting rid u,positive
,,,"OurSkyyxMySchoolPresidentEP If I want to watch them exchange identities, I can definitely use AI face changing technology instead of wasting two such good actors to repeat it. Very wasteful of time",,,OurSkyyxMySchoolPresidentEP want watch exchange identity definitely use AI face changing technology instead wasting two good actor repeat Very wasteful time,positive
,,,"Absolutely! AI is perfect for Malignant Actors to generate propaganda, disinformation and conspiracy theories. The human mind is the weakest link in the information chain. This weakness will be exploited, as it has for centuries.",,,Absolutely ! AI perfect Malignant Actors generate propaganda disinformation conspiracy theory human mind weakest link information chain weakness exploited century,negative
,,,You can only have ownership as IP over creative expressions. Producers have it because voice actors licenced their work (ip) to them. No one can have ownership over any ai output,,,ownership IP creative expression Producers because voice actor licenced work ip No one ownership ai output,positive
,,,There's already bad actors if AI becomes a common place Republican voters will be even more confused the rhetoric Republican politicians constituents tax cuts for the rich is good less money going into the Treasury is good just think when is less money coming in your home good,,,already bad actor AI becomes common place Republican voter even more confused rhetoric Republican politician constituent tax cut rich good le money going Treasury good think le money coming home good,positive
,,,"If good actors can leverage GenerativeAI to bolster security, bad actors can turn the tables. AI's double-edged sword:",,,good actor leverage GenerativeAI bolster security bad actor turn table AI double-edged sword,positive
,,,should hire new actors to read the news for if and are so lazy that they can't tell the difference between chat bots that have been around for a decade or two and Generative AI that has emerged over the past few years.,,,should hire new actor read news lazy tell difference chat bot around decade two Generative AI emerged past year,negative
,,,"Today's TechTipOfTheWeek: Be careful with unsolicited links and only obtain apps from official app stores. With generative AI tools getting better, bad actors can now more easily generate messages that are designed to manipulate consumers into clicking on dangerous links.",,,Today TechTipOfTheWeek careful unsolicited link obtain apps official app store generative AI tool getting better bad actor more easily generate message designed manipulate consumer clicking dangerous link,negative
,,,"Ok , please also help to stop describing ""generative AI"" a ""chat bot"" as they are completely different technologies. That would be like me referring to news anchors and reporters as paid actors because they are very similar in appearance and they are on TV.",,,Ok please also help stop describing generative AI chat bot completely different technology would like referring news anchor reporter paid actor because very similar appearance TV,positive
,,,AI will one day take up actors jobs..,,,AI one day take actor job,neutral
,,,I want to believe that regulations are focus on bad actors and no on Ai itself,,,want believe regulation focus bad actor no Ai,negative
,,,I don't believe anything anymore. Actors or AI or Reality. Nothing is above suspicion.,,,believe anything anymore Actors AI Reality Nothing suspicion,positive
,,,"As someone with access to sota ai info and who knows there are bad actors, I'm ready for you",,,someone access sota ai info know bad actor ready,negative
,,,"Im looking for an AI programmer to create TV/MOVIE Production. So like we the CREATIVES, the Writers,Directors &amp; Actors dont need to pay or use Producers anymore. Anyone know a AI programmer??? ",,,Im looking AI programmer create TV/MOVIE Production like CREATIVES Writers Directors Actors dont need pay use Producers anymore Anyone know AI programmer ? ? ?,positive
,,,"Voice actors...here's a company I've got my crosshairs on. ANy company bragging about ""putting voice actors out of business"" is most likeyl stealing voice actor's works and selling it right back as trash AI If you use AI voices, art, writing etc-you deserve no artistic enjoyment",,,Voice actorshere company 've got crosshairs company bragging putting voice actor business most likeyl stealing voice actor work selling right back trash AI use AI voice art writing etc-you deserve no artistic enjoyment,negative
,,,"AI is already replacing voice actors for low budget stuff, is on the verge of replacing animation (which, in itself, is also acting) with those combined can replace both TV and film. Sure, there's still the stage you mentioned but that needs govt handouts just to survive.",,,AI already replacing voice actor low budget stuff verge replacing animation also acting combined replace TV film Sure still stage mentioned but need govt handout survive,neutral
,,,"Actors don't simulate whole humans any more than anyone does. To have a hand you don't have to think about having a hand; AI does. And why do theaters matter? Nobody goes to theaters any more, not even movie theaters. If you can stream it you have what matters in the industry.",,,Actors simulate whole human more anyone hand think hand AI theater matter ? Nobody go theater more not even movie theater stream matter industry,positive
,,,"Yes, AI can be used for many great things. But just like everything else, a good time is always wrecked by the actions of a few bad actors. AI is ALREADY in the hands of evil people",,,Yes AI used many great thing But like everything else good time always wrecked action bad actor AI ALREADY hand evil people,positive
,,,"Listen to this min clip from the Senate AI regulation hearing. ""Democracy itself is threatened."" The list of threats posed by AI this witness spews has long been mastered by humans and state actors. H/T , who posted an extensive highlight video.",,,Listen min clip Senate AI regulation hearing Democracy threatened list threat posed AI witness spews long mastered human state actor posted extensive highlight video,negative
