Unnamed: 0,Time,User,Tweet,Location,Retweets,cleaned_tweet,label
,,,"If Im reading this correctly, its talking about using image AI to match the mouth movements of actors for foreign language dubbing which, if it proves popular, could create more work for voice actors around the world. Seems like a net positive? Could be downside Im missing.",,,Im reading correctly talking using image AI match mouth movement actor foreign language dubbing prof popular could create more work voice actor around world Seems like net positive ? Could downside Im missing,positive
,,,"True to form, Ari Melbar is boosting Ai. The only threat he sees? The Government. Right. Make The Government the boogie man, not hostile actors. Just The Government.",,,True form Ari Melbar boosting Ai threat see ? Government Right Make Government boogie man not hostile actor Government,positive
,,,"Today, established AI companies and the same federal agencies are working to limit widespread AI, due to the same sorts of fears. AI punks must stand up and work against these same actors to once again protect the future",,,Today established AI company federal agency working limit widespread AI due sort fear AI punk must stand work against actor protect future,negative
,,,This is our chance to secure fair compensation and up-to-date residuals that accurately reflect the current state of our industry. We must put a stop to any attempts by studios to replace us with AI and ensure that self tapes remain manageable for actors.,,,chance secure fair compensation up-to-date residual accurately reflect current state industry must put stop attempt studio replace u AI ensure self tape remain manageable actor,positive
,,,"Or a bunch or AI/ML shit nerds are gonna bring deepfakes to Hollywood, would be funny to see the most highly paid actors to be the first automated out of a job I was befuddled when to writers guild strike started and none of then talked about forcing studios to ban the use of AI",,,bunch AI/ML shit nerd gon na bring deepfakes Hollywood would funny see most highly paid actor first automated job befuddled writer guild strike started none talked forcing studio ban use AI,negative
,,,All AI BS brings out my voice actors need better treatment rant.,,,AI BS brings voice actor need better treatment rant,positive
,,,A.I. Company Wants To Visually 'Dub' Non-English Film Actors' Faces And We Have Questions Movies,,,A.I Company Wants Visually 'Dub Non-English Film Actors Faces Questions Movies,neutral
,,,"Is A.I. that matches an actor's lip movements to the audio dub just a neat bit of tech, or the gateway to something worse?",,,A.I match actor lip movement audio dub neat bit tech gateway something worse ?,neutral
,,,"While the arguments between the three Sonics via AI are entertaining to listen to, I cant in good conscience support that. This push for AI is going to disrupt the livelihoods of voice actors.",,,While argument three Sonics via AI entertaining listen cant good conscience support push AI going disrupt livelihood voice actor,negative
,,,"Follow Up: I had Jasper AI develop a pitch for a &amp; Barry crossover series. The premise: Barry ends up being Ted's presumed-dead father. I know the timeline doesn't work with the current actors and their ages, but boy, that concept would be NUTS.",,,Follow Jasper AI develop pitch Barry crossover series premise Barry end Ted presumed-dead father know timeline doesn work current actor age but boy concept would NUTS,negative
,,,"voice actors, as the industry continues to strike, adjust your contracts and MAKE SURE to put AI clauses in there that prevent the theft of your voice! Don't let corporations steal your voice! (Elon is suppressing that hashtag LOL)",,,voice actor industry continues strike adjust contract MAKE SURE put AI clause prevent theft voice ! let corporation steal voice ! Elon suppressing hashtag LOL,positive
,,,I just really do not understand why writers and actors and painters are the ones worried about AI and not accountants ?? like why am I still doing my own taxes???,,,really not understand writer actor painter one worried AI not accountant ? ? like still tax ? ? ?,negative
,,,"Im not talking about paid models, Im talking about ai stealing the jobs of writers, artists, voice actors, etc. It needs regulation.",,,Im not talking paid model Im talking ai stealing job writer artist voice actor etc need regulation,negative
,,,"So how long till Ai is creating movie content? ML trained based on actors we like, writing scripts and stories, based on moves, genres and cinematography and style we like, generating sets, scenes, effects, storyboards... You get the idea.",,,long till Ai creating movie content ? ML trained based actor like writing script story based move genre cinematography style like generating set scene effect storyboards get idea,positive
,,,"Either way I dont think disinformation is a big deal anymore. Everyone gets it now. Theres a bunch of bs on the internet and there are bad actors making it on purpose. But we dont need any disinformation departments or anything. That is overblown, just like AI",,,Either way dont think disinformation big deal anymore Everyone get Theres bunch b internet bad actor making purpose But dont need disinformation department anything overblown like AI,positive
,,,one of the most charismatic actors- should be enshrined in HOF with book on portrait AI persevere stream encapsulate essence and presentation of wills and estates,,,one most charismatic actors- should enshrined HOF book portrait AI persevere stream encapsulate essence presentation will estate,neutral
,,,"Its awful. AI IS DISGUSTING. And should not even be happening, and if anyone supports it they should ashamed for being willing to hurt creators and actors. Its stealing and should be punishable",,,awful AI DISGUSTING should not even happening anyone support should ashamed willing hurt creator actor stealing should punishable,negative
,,,This isnt a re-creation. Looks like an AI replacement to make the actors look like kids.,,,isnt re-creation Looks like AI replacement make actor look like kid,negative
,,,seeing the pattern of big corporations deleting content/services and wondering what is going on and if it has anything to do with investment in AI and punishing real artists/writers/actors in a time of unions/guilds and replacing stuff with GenAI content?,,,seeing pattern big corporation deleting content/services wondering going anything investment AI punishing real artists/writers/actors time unions/guilds replacing stuff GenAI content ?,negative
,,,The risk is not AI taking over as no one is even close to that or any kind of AGI at the moment but misuse of the current tech by bad actors&gt; how is licensing going to solve that? Its red tape gibberish. You basically want more paper work to approve large language models,,,risk not AI taking no one even close kind AGI moment but misuse current tech bad actor gt licensing going solve ? red tape gibberish basically want more paper work approve large language model,positive
,,,"Now is this AI learning and will that be used in the future to replace on screen actors? Maybe? We need to put some checks and balances in place and advertise/label AI altered work as just that, but I think Pandora's box is open on this one. Time for damage control.",,,AI learning used future replace screen actor ? Maybe ? need put check balance place advertise/label AI altered work but think Pandora box open one Time damage control,negative
,,,"I think it's adding admin jobs to process the AI adjustments, but, no, they would still need foreign language voice actors. The video in the article is pretty cool. Original language versions will still be distributed with subtitles.",,,think adding admin job process AI adjustment but no would still need foreign language voice actor video article pretty cool Original language version still distributed subtitle,positive
,,,hypothetical: the madness were dealing with is all an AI generated script with these lifetime actors playing their roles as directed,,,hypothetical madness dealing AI generated script lifetime actor playing role directed,negative
,,,"Actors, AI staged isant that what your response would have been lol",,,Actors AI staged isant response would lol,positive
,,,"There are some really bad actors out there. I had an author say that Ai writing is horrible for authors, but AI images is a gift to them.",,,really bad actor author say Ai writing horrible author but AI image gift,positive
,,,I think people wont take the threat seriously enough until something bad happens. Either way I think our biggest issue will be controlling AI from bad actors,,,think people wont take threat seriously enough something bad happens Either way think biggest issue controlling AI bad actor,negative
,,,AI Becomes Him: How De-Aging Progressed from Benjamin Button to Indiana Jones and the Dial of Destiny via,,,AI Becomes De-Aging Progressed Benjamin Button Indiana Jones Dial Destiny via,neutral
,,,"""We can just replace actors with AI!!!"" Ok, bet",,,replace actor AI ! ! ! Ok bet,positive
,,,"As everyone is navel-gazing about the art/media implications of AI, it becomes clear to me that many people think actors are just puppets already, rather than artists who make tons of complex creative choices. That probably pisses actors off more than fear of displacement.",,,everyone navel-gazing art/media implication AI becomes clear many people think actor puppet already rather artist make ton complex creative choice probably piss actor more fear displacement,negative
,,,"I mostly fear that AI will change the future for the worst. For example,a lot of AI softwares and sites just rob actors voices to then use them to say things even inappropriate without their permission and consent.",,,mostly fear AI change future worst example lot AI software site rob actor voice use say thing even inappropriate without permission consent,negative
,,,"the industry has been upending the writers and actors and directors for a very long time... including the use of AI. It strikes me as a human obscenity for there to be pushback on that from the producers"" - Sean Penn at Cannes Film Festival WGAStrong",,,industry upending writer actor director very long time including use AI strike human obscenity pushback producer Sean Penn Cannes Film Festival WGAStrong,positive
,,,"If we could make productions with fake AI people than these actors who dont deserve it wont get paid the millions of dollars they do. I have a harder, more important and more stressful job yet they make more money than me, I call bullshit.",,,could make production fake AI people actor dont deserve wont get paid million dollar harder more important more stressful job yet make more money call bullshit,negative
,,,"For the second time in as many months I have voted YES to authorize a strike against the AMPTP. Actors deserve clear guidelines on the use of generative AI and deserve residual pay that reflects the modern TV landscape. Two unions, one fight. ",,,second time many month voted YES authorize strike against AMPTP Actors deserve clear guideline use generative AI deserve residual pay reflects modern TV landscape Two union one fight,positive
,,,"This is completely devoid of any charm or charisma Ryan Reynolds has. AI is a mockery of actors, writers, artists and all creatives.",,,completely devoid charm charisma Ryan Reynolds AI mockery actor writer artist creatives,positive
,,,AI Becomes Him: How De-Aging Progressed from Benjamin Button to Indiana Jones and the Dial of Destiny,,,AI Becomes De-Aging Progressed Benjamin Button Indiana Jones Dial Destiny,neutral
,,,"The most bullshit thing about AI for voice actors, is that companies could totally use your voice as training data, and then use something that sounds similar to you to advertise something totally gross like have you do voice over for a queer-hating Republican's attack.",,,most bullshit thing AI voice actor company could totally use voice training data use something sound similar advertise something totally gross like voice queer-hating Republican attack,negative
,,,"No wonder there's a WritersStrike after seeing this AI Ryan Reynolds, maybe actors should be going on strike as well.",,,No wonder WritersStrike seeing AI Ryan Reynolds maybe actor should going strike well,negative
,,,"Writers, actors, special effects, music, &amp; every other part of motion pictures will be replaced with AI &amp; other technologies as it is more efficient, lower cost &amp; offers greater flexibility than humans. If Hollywood wont then other venues will. Full stop",,,Writers actor special effect music every part motion picture replaced AI technology more efficient lower cost offer greater flexibility human Hollywood wont venue Full stop,positive
,,,"that's a very stupid thing to bee happy about, sure there are some translators or voice actors that can be annoying but the majority are not and i strongly believe AI will just make the issues you have with it even worse",,,very stupid thing bee happy sure translator voice actor annoying but majority not strongly believe AI make issue even worse,negative
,,,"I'm inclined to say that AI trading stocks should be banned yesterday, but the problem is that the impulse for individual actors to do it is going to be overwhelming and enforcement would be impossible. So we should just ban the stock market instead",,,inclined say AI trading stock should banned yesterday but problem impulse individual actor going overwhelming enforcement would impossible should ban stock market instead,negative
,,,"We take an actors opinion as important, because? All he is, is a human puppet. Soon to be replaced with AI that can take direction.",,,take actor opinion important because ? human puppet Soon replaced AI take direction,positive
,,,"Curious to hear what folks think about this category of AI tech. Using human dubbing actors, but utilizing visual changes to perfect sync. Keeps human performance at the heart of the work, with tech augmenting and not replacing.",,,Curious hear folk think category AI tech Using human dubbing actor but utilizing visual change perfect sync Keeps human performance heart work tech augmenting not replacing,positive
,,,"I get that writers and actors should be scared of what can be done with AI, but the only thing scary about this video is how proud they seem to be about their work.",,,get writer actor should scared done AI but thing scary video proud seem work,negative
,,,"The information looks real. But it isnt. Thats the problem. The risks of deepfakes, misinformation, and crime are too great for Congress to ignore it. If bad actors harness this power, it could be catastrophic. TLDR: REGULATE AI.",,,information look real But isnt Thats problem risk deepfakes misinformation crime great Congress ignore bad actor harness power could catastrophic TLDR REGULATE AI,negative
,,,"Pay the writers, pay the actors! No to AI! These studios need to learn",,,Pay writer pay actor ! No AI ! studio need learn,negative
,,,"Truth Actors have to come out and now with AI could really make a dent in film. Of course dont refer to yourselves from Hollywood maybe: Hollygood or some other name Hollywood term is. Just put God, Truth &amp; Country first and Hollygood Magicwill manifest!",,,Truth Actors come AI could really make dent film course dont refer Hollywood maybe Hollygood name Hollywood term put God Truth Country first Hollygood Magicwill manifest !,positive
,,,"Maybe in ten or five or one year, AI will be able to make Fleabag Season , but maybe it will happen *never* and studios are digging in their heels for the right to replace writers and actors with Furby-level brains that spout random garbage for the foreseeable future.",,,Maybe ten five one year AI able make Fleabag Season but maybe happen never studio digging heel right replace writer actor Furby-level brain spout random garbage foreseeable future,neutral
,,,"This take on the AI images is so bad / the joke is dead already. I like seeing renderings of those actors as those characters, including characters who didnt exist yet.",,,take AI image bad joke dead already like seeing rendering actor character including character didnt exist yet,negative
,,,honestly this looks like AI younging down the pics of the original actors.,,,honestly look like AI younging down pic original actor,positive
,,,Seeing one of my favourite voice actors talk about AI like this is just perfect. Couldnt agree more with your views on this stuff,,,Seeing one favourite voice actor talk AI like perfect Couldnt agree more view stuff,positive
,,,This has to be AI. It's very unlikely that all the kids look exactly like their actors counterpart.,,,AI very unlikely kid look exactly like actor counterpart,positive
,,,"Can AI be trained to codify human values? If so wouldnt that take care of the problem? Having said that, bad actors could easily codify ugly values.",,,AI trained codify human value ? wouldnt take care problem ? said bad actor could easily codify ugly value,negative
,,,"AI is dangerous for all creatives. Not only do these AI companies and organizations scrape our written and visual art, but also the voices and bodies of actors and performers. (/?)",,,AI dangerous creatives Not AI company organization scrape written visual art but also voice body actor performer ?,negative
,,,They even already replace actors. Between the de-agining technology and that seen in the Disney Plus movie where the crowd was filled with AI people,,,even already replace actor de-agining technology seen Disney Plus movie crowd filled AI people,neutral
,,,"To put the kibosh on AI The people who are being used as frames of reference for it's 'creations', and the actors who are being placed in them should sue. If they are going to write eps of CSI then anyone who has ever written one should sue. They can't create without reference.",,,put kibosh AI people used frame reference 'creations actor placed should sue going write eps CSI anyone ever written one should sue create without reference,positive
,,,"We must do this - give our Negotiators the power they need. Self Tapes are out of control, we need guidelines built into our contracts, AI are not actors but a way to steal our likeness &amp; performances and not pay us. Residuals in streaming are essential. Vote ""Yes""",,,must give Negotiators power need Self Tapes control need guideline built contract AI not actor but way steal likeness performance not pay u Residuals streaming essential Vote Yes,negative
,,,Hollywood needs to shut down because people with all the money not only refuse to pay writers &amp; actors a fair cut of the BILLIONS they are making off our labor but also hope to one day use AI &amp; other advanced technology to replace writers &amp; actors. THIS IS AN EXISTENTIAL FIGHT.,,,Hollywood need shut down because people money not refuse pay writer actor fair cut BILLIONS making labor but also hope one day use AI advanced technology replace writer actor EXISTENTIAL FIGHT,positive
,,,I will never buy an audio book that does not have a real life voice actor bringing it to life. Publishers must provide assurances that their actors are real. We purchasers must insist that we will never buy an AI audiobook.,,,never buy audio book not real life voice actor bringing life Publishers must provide assurance actor real purchaser must insist never buy AI audiobook,positive
,,,Because i can also take a book and storyboard it now. For MOSTLY FREE. I can use ai to make my own movies with Unreal Engine to make actors a nothing.,,,Because also take book storyboard MOSTLY FREE use ai make movie Unreal Engine make actor nothing,positive
,,,"If you believe in the great awakening and some of the digital warriors reporting commy, KILLERY, big pappy, song bird, and even CHINA JO JO HAVE BEEN ARRESTED &amp; or executed already, &amp; the ones we see now are either doubles, clones,masked actors or CGI AND OR AI HMMM",,,believe great awakening digital warrior reporting commy KILLERY big pappy song bird even CHINA JO JO ARRESTED executed already one see either double clone masked actor CGI AI HMMM,positive
,,,"At some point in the future, AI will be so far developed that it will create different characters, replacing all actors and musicians. We won't be able to shut AI down because we care about the way it ""feels"", leading to AI enslaving the human race",,,point future AI far developed create different character replacing actor musician won able shut AI down because care way feel leading AI enslaving human race,positive
,,,"Robert Zemeckis announced that Tom Hanks &amp; Robin Wright, the stars of his next film, will be de-aged using AI to create photorealistic face swaps and de-aging effects on top of actors performances live and in real time without the need for further compositing or VFX work.",,,Robert Zemeckis announced Tom Hanks Robin Wright star next film de-aged using AI create photorealistic face swap de-aging effect top actor performance live real time without need compositing VFX work,positive
,,,As an actual Factory Worker who has experienced machines and low skilled labor ruin wages and job markets. I smile when I see translators and voice actors getting replaced by AI-,,,actual Factory Worker experienced machine low skilled labor ruin wage job market smile see translator voice actor getting replaced AI-,negative
,,,"Also the show is about Girls' Generation Jessica Jung, singer Kelly Yu, Jazz artist Liu Lian, New Pants bassist Zhao Meng, and actors Zhang Li + Tian Ai trying to run a seaside band cafe without going bankrupt and it's the Best Thing Everrrrr",,,Also show Girls Generation Jessica Jung singer Kelly Yu Jazz artist Liu Lian New Pants bassist Zhao Meng actor Zhang Li Tian Ai trying run seaside band cafe without going bankrupt Best Thing Everrrrr,negative
,,,"God. Ethics aside, this is just so creepy to look at. The thought process behind replacing actors with uncanny valley ai renderings of actors that aren't even fully animated in their movements is so weird.",,,God Ethics aside creepy look thought process behind replacing actor uncanny valley ai rendering actor even fully animated movement weird,neutral
,,,Seeing UKHE and the actors of its broader ecology embarrassingly jumping on the supposed AI supposed revolution only shows how those running the sector have completely lost their critical skills and just jump on whatever silly fad markets come up with.,,,Seeing UKHE actor broader ecology embarrassingly jumping supposed AI supposed revolution show running sector completely lost critical skill jump whatever silly fad market come,negative
,,,"Embrace AI like you would embrace a new form of writing, or a new paintbrush, camera. Its just a new tool and medium to discover, and make a living doing it. Im sure th century stage actors were horrified by the invention of the television..",,,Embrace AI like would embrace new form writing new paintbrush camera new tool medium discover make living Im sure th century stage actor horrified invention television,positive
,,,I know that software is cool but PLEASE DO NOT SUPPORT Voice AI Generated Software! Make that man BANKRUPT BECAUSE OF VOICE ACTING IS FOR VOICE ACTORS IN FLESH ONLY.,,,know software cool but PLEASE NOT SUPPORT Voice AI Generated Software ! Make man BANKRUPT BECAUSE VOICE ACTING VOICE ACTORS FLESH,negative
,,,"Justine Bateman lays out a cogent argument about AI in the entertainment industry, and why actors and writers ought to be concerned. And yet I think she, like her fellow actors and writers, misses a very simple point: they have less leverage than they think.",,,Justine Bateman lay cogent argument AI entertainment industry actor writer ought concerned yet think like fellow actor writer miss very simple point le leverage think,positive
,,,This is what Vanille wants to end up. Vanille is pne of the voice actors in Mobile Legends Game. Melon Mask invested for that programme. So how to stop this? I prefer voice actors in flesh rather than AI softwares. People are already natural robotsalways making mistakes too.,,,Vanille want end Vanille pne voice actor Mobile Legends Game Melon Mask invested programme stop ? prefer voice actor flesh rather AI software People already natural robotsalways making mistake,negative
,,,"I shudder at the prospect of all movies for the next + years exclusively featuring AI Brad Pitt, AI Tom Cruise, AI Ana de Armas, etc... with no new actors other than procedurally generated AI actors, all pasted onto the bodies of low wage stunt doubles.",,,shudder prospect movie next year exclusively featuring AI Brad Pitt AI Tom Cruise AI Ana de Armas etc no new actor procedurally generated AI actor pasted onto body low wage stunt double,negative
,,,"meanwhile sam is convinced that the ad stole a specific swear/phrase from one of cramblin duvets old commercials so he reaches out to the rival agency only to find out that theyre actually severely in debt, which is why they cant hire real actors or writers and use AI to",,,meanwhile sam convinced ad stole specific swear/phrase one cramblin duvet old commercial reach rival agency find theyre actually severely debt cant hire real actor writer use AI,negative
,,,Remember Andrew Niccol's movie Smne? Are we in those times already? - with AI actors ...,,,Remember Andrew Niccol movie Smne ? time already ? AI actor,neutral
,,,"Don't need them anymore, AI will make their jobs obsolete. Same with camera operators, special effects, stunt people and even actors.",,,need anymore AI make job obsolete camera operator special effect stunt people even actor,positive
